URL,Location,Company,Employment Type,Years of Exp,Education Level,Data
"https://www.glassdoor.com/job-listing/software-engineer-ii-fis-global-JV_IC1127429_KO0,20_KE21,31.htm?jl=1009107656672",Alabama,FIS Global,Fulltime,not given,,"Position Type : Full time Type Of Hire : Experienced (relevant combo of work and education) Education Desired : Bachelor of Computer Engineering Travel Percentage : 0% Job Description About FIS Are you curious, motivated, and forward-thinking? At FIS you’ll have the opportunity to work on some of the most challenging and relevant issues in financial services and technology. Our talented people empower us, and we believe in being part of a team that is open, collaborative, entrepreneurial, passionate and above all fun. About the team You will be joining a small team of developers working in an Agile environment on a web-based product we license to our financial customers. We use scrum methodologies to rapidly deliver the features our customers demand so that they can be competitive in their markets. What you will be doing You will be a full stack developer working on a front-end web application that communicates to back-end APIs. You will be interacting with your team members and product management to deliver the features our customers require. Some of the tasks you will be doing include:Web based UI design.Creating and modifying APIs.Writing SQL queries.Creating and executing test cases. What you bringKnowledge of web-based design using JavaScript frameworks such as Angular.Familiarity with how relational databases work and best practices for developing/modifying database objects such as tables, indexes, and queries.Strong communication skills and the ability to implement ideas clearly and correctly.Ability to work with minimal supervision. Bonus if you have o Angular o Oracle Databases o TypeScript/JavaScript o C#, C++ o Microsoft Visual Studio o GIT Source Control What we offer youA competitive salary.A fantastic range of benefits designed to help support your lifestyle and wellbeing.Varied and challenging work to help you grow your technical skillset.  FIS is committed to providing its employees with an exciting career opportunity and competitive compensation. The pay range for this full-time position is $83,060.00 - $139,530.00 and reflects the minimum and maximum target for new hire salaries for this position based on the posted role, level, and location. Within the range, actual individual starting pay is determined additional factors, including job-related skills, experience, and relevant education or training. Any changes in work location will also impact actual individual starting pay. Please consult with your recruiter about the specific salary range for your preferred location during the hiring process. Privacy Statement FIS is committed to protecting the privacy and security of all personal information that we process in order to provide services to our clients. For specific information on how FIS protects personal information online, please see the Online Privacy Notice. EEOC Statement FIS is an equal opportunity employer. We evaluate qualified applicants without regard to race, color, religion, sex, sexual orientation, gender identity, marital status, genetic information, national origin, disability, veteran status, and other protected characteristics. The EEO is the Law poster is available here supplement document available here For positions located in the US, the following conditions apply. If you are made a conditional offer of employment, you will be required to undergo a drug test. ADA Disclaimer: In developing this job description care was taken to include all competencies needed to successfully perform in this position. However, for Americans with Disabilities Act (ADA) purposes, the essential functions of the job may or may not have been described for purposes of ADA reasonable accommodation. All reasonable accommodation requests will be reviewed and evaluated on a case-by-case basis. Sourcing Model Recruitment at FIS works primarily on a direct sourcing model; a relatively small portion of our hiring is through recruitment agencies. FIS does not accept resumes from recruitment agencies which are not on the preferred supplier list and is not responsible for any related fees for resumes submitted to job postings, our employees, or any other part of our company. #pridepass"
"https://www.glassdoor.com/job-listing/junior-level-software-engineer-e4-technology-JV_IC1127653_KO0,30_KE31,44.htm?jl=1006860143465",Alabama,E,,2,Master,"Categories Software Enginer  Salary TBD  Location Huntsville, AL  Job Information Job Description  Junior-level Software Engineer supporting current Army Programs  If you are a Software Engineer with experience, please read on! E4 Technology, Inc. is a Professional, Engineering, and Information Technology (IT) Services Company focused on delivering tailored solutions to our customers. We provide a range of services to include the following:  Program Management Software Development Interoperability and Integration Testing Configuration Management Security Consulting Hardware Sales Integrated IT Solutions and Support  We are currently seeking qualified individuals with a minimum of 2 years Software Development experience to work directly onsite at one of our Army Government Customer installations. In addition the minimum experience and skillset identified below, a current DoD Secret Security Clearance is a plus, however, new security clearances can be issued by the customer on a case-by-case basis.  Top Reasons to Work with Us  E4 Technology, Inc. is a great small company that is growing and has the most competitive benefits and compensation package across industry.  What You Will Be Doing  In this role you will be responsible for deriving requirements, documenting the design and data structures, and developing software in Java and C++. The ideal candidate must be familiar with the software development life-cycle and familiarity with Agile principles. Additionally, understanding and how to follow CMMI practices is a plus.  What You Need for this Position  Minimum Education and/or Experience required:  Bachelor’s of Science Degree in Computer Science, Computer Engineering, or similar technical degree is required with a minimum of 2 years’ experience or a Master’s Degree and 1 years of experience, or at least 6 years of software development experience may be substituted in lieu of bachelor’s degree on a case-by-case basis. Experience developing software with Java and C++ in object oriented Working experience with Microsoft and LINUX operating environments  Preferred, but not required:  Current DoD Secret Security Clearance Experience developing HTML5 Web Applications Experience developing software under Agile principles Experience with User Interfaces (UI) and Human/Machine Interface (HMI) concepts Experience with Eclipse and Visual Studio is desired Other preferred Experience with the following tools and application concepts is a plus: Maven, Junit, Easy Mock, JIRA, GET, Fisheye, Bitbucket, World Wind, SIMDIS, ESRI, GJIS, BOSS, NSITE, Wireshark, LUA, Bash, Perl, and VMWare. What’s In It for You?  Competitive Salary, Strong Compensation and Benefits package! If you are a Software Engineer that meets the minimum aforementioned requirements, please apply today!  Our Privacy and Company Policies E4 Technology, Inc. is proud to be an Equal Opportunity Employer.  All qualified applicants will receive consideration for employment without regard to race, color, religion, sex, national origin, disability, protected veteran status, or any other characteristic protected by law.  Applicant’s resume and any other personal information will be kept completely confidential and will not be retransmitted, forwarded, etc. without prior consent from the applicant. In compliance with federal law, all persons hired will be required to verify identity and eligibility to work in the United States and to complete the required employment eligibility verification document form upon hire.  Thank you for considering E4 Technology, Inc.! We look forward to receiving your resume and going over the position with you in more detail!"
"https://www.glassdoor.com/job-listing/mid-level-software-engineer-e4-technology-JV_IC1127653_KO0,27_KE28,41.htm?jl=1006860143449",Alabama,E,,6,Master,"Categories Software Enginer  Salary TBD  Location Huntsville, AL  Job Information Job Description  Mid-level Software Engineer supporting current Army Programs  If you are a Software Engineer with experience, please read on! E4 Technology, Inc. is a Professional, Engineering, and Information Technology (IT) Services Company focused on delivering tailored solutions to our customers. We provide a range of services to include the following:  Program Management Software Development Interoperability and Integration Testing Configuration Management Security Consulting Hardware Sales Integrated IT Solutions and Support  We are currently seeking qualified individuals with a minimum of 6 years Software Development experience to work directly onsite at one of our Army Government Customer installations. In addition the minimum experience and skillset identified below, a current DoD Secret Security Clearance is a plus, however, new security clearances can be issued by the customer on a case-by-case basis.  Top Reasons to Work with Us  E4 Technology, Inc. is a great small company that is growing and has the most competitive benefits and compensation package across industry.  What You Will Be Doing  In this role you will be responsible for deriving requirements, documenting the design and data structures, and developing software in Java and C++. The ideal candidate must be familiar with the software development life-cycle and familiarity with Agile principles. Additionally, understanding and how to follow CMMI practices is a plus.  What You Need for this Position  Minimum Education and/or Experience required:  Bachelor’s of Science Degree in Computer Science, Computer Engineering, or similar technical degree is required with a minimum of 6 years’ experience or a Master’s Degree and 4 years of experience, or at least 10 years of software development experience may be substituted in lieu of bachelor’s degree on a case-by-case basis. Experience developing software with Java and C++ in object oriented Working experience with Microsoft and LINUX operating environments  Preferred, but not required:  Current DoD Secret Security Clearance Experience developing HTML5 Web Applications Experience developing software under Agile principles Experience with User Interfaces (UI) and Human/Machine Interface (HMI) concepts Experience with Eclipse and Visual Studio is desired Other preferred Experience with the following tools and application concepts is a plus: Maven, Junit, Easy Mock, JIRA, GET, Fisheye, Bitbucket, World Wind, SIMDIS, ESRI, GJIS, BOSS, NSITE, Wireshark, LUA, Bash, Perl, and VMWare. What’s In It for You?  Competitive Salary, Strong Compensation and Benefits package! If you are a Software Engineer that meets the minimum aforementioned requirements, please apply today!  Our Privacy and Company Policies E4 Technology, Inc. is proud to be an Equal Opportunity Employer.  All qualified applicants will receive consideration for employment without regard to race, color, religion, sex, national origin, disability, protected veteran status, or any other characteristic protected by law.  Applicant’s resume and any other personal information will be kept completely confidential and will not be retransmitted, forwarded, etc. without prior consent from the applicant. In compliance with federal law, all persons hired will be required to verify identity and eligibility to work in the United States and to complete the required employment eligibility verification document form upon hire.  Thank you for considering E4 Technology, Inc.! We look forward to receiving your resume and going over the position with you in more detail!"
"https://www.glassdoor.com/job-listing/computer-programmer-008446-university-of-south-alabama-JV_IC1127676_KO0,26_KE27,54.htm?jl=1009112458616",Alabama,University of South Alabama,"Fulltime, Parttime, Temporary",not given,,"Minimum Qualifications Bachelor’s degree in computer science or a related field from an accredited institution as approved and accepted by the University of South Alabama. An equivalent combination of education and experience may be considered.  Preferred Qualifications Experience with Oracle SQL, Ellucian Banner, and Linux is preferred.  Job Description Summary The University of South Alabama’s Computer Services Center is seeking to hire a Computer Programmer. Interested candidates should apply to be considered.   Essential Functions These are the job duties required of the position. Essential Functions Serves as support for University departments to includes Student, Payroll, Human Resources, Financial Aid, and Finance. Under direct supervision, develops, tests, and implements computer programs on multiple computer/operating system platforms. Writes and maintains ad hoc reports on an Oracle Database. Provides backup support to other Computer Center staff to include answering questions and troubleshooting various systems. Regular and prompt attendance. Ability to work schedule as defined and additional hours as required. Related duties as required.  Posting Information Number of Vacancies 1  Position End Date (if temporary)  Job Open Date 02/06/2024  Job Close Date  Open Until Filled Yes  Special Instructions to Applicants  Working Days Monday - Friday  Working Hours 8:00 a.m. - 5:00 p.m.  Job Location Main Campus  Full-time or Part-Time Full Time  Regular or Temporary Regular"
"https://www.glassdoor.com/job-listing/software-developer-motion-JV_IC1127429_KO0,18_KE19,25.htm?jl=1009112913688",Alabama,Motion,,not given,MA,"SUMMARY The Software Developer develops information systems by designing, developing, and installing software solutions. This position improves operations by conducting systems analysis and recommending changes in policies and procedures. JOB DUTIES Designs and constructs moderately complex interfaces between ERP and legacy systems. Uses back-end programming languages, as well as front-end script languages to optimize performance, scalability, and security. Codes programming logic for new or existing solutions software or applications in accordance to design specifications put in place by senior software development staff and leadership. Handles installation, configuration, development, workflow design, monitoring, and/or upgrade of assigned software products. Monitors quality and performance of applications through testing and maintenance. Maintains up-to-date records of issues with existing code. Suggests viable solutions to resolve issues with existing software. Performs other assigned duties.  EDUCATION & EXPERIENCE Typically requires a bachelor’s degree in computer science, software engineering, or a related field Three (3) to five (5) years of back-end programing languages (ASP Java, Perl, C++, etc.) and front-end scripting languages (HTML5, JavaScript, CSS) or an equivalent combination.  KNOWLEDGE, SKILLS, ABILITIES Manages multiple tasks simultaneously while meeting deadlines. Possess the latest knowledge on new technology and computer systems. Communicates complex procedures to other colleagues. Understands the latest trends and their role in a commercial environment. Pays close attention to detail and desires to probe further into data.  PHYSICAL DEMANDS: LICENSES & CERTIFICATIONS: None required.  SUPERVISORY RESPONSIBILITY: No Supervisory Responsibility  BUDGET RESPONSIBILITY: No  COMPANY INFORMATION: Motion Industries offers an excellent benefits package which includes options for healthcare coverage, 401(k), tuition reimbursement, vacation, sick, and holiday pay. Not the right fit? Let us know you're interested in a future opportunity by joining our Talent Community on jobs.genpt.com or create an account to set up email alerts as new job postings become available that meet your interest! GPC conducts its business without regard to sex, race, creed, color, religion, marital status, national origin, citizenship status, age, pregnancy, sexual orientation, gender identity or expression, genetic information, disability, military status, status as a veteran, or any other protected characteristic. GPC's policy is to recruit, hire, train, promote, assign, transfer and terminate employees based on their own ability, achievement, experience and conduct and other legitimate business reasons."
"https://www.glassdoor.com/job-listing/software-quality-assurance-engineer-ai-solutions-inc-JV_IC1127653_KO0,35_KE36,52.htm?jl=1008880030728",Alabama,"a.i. solutions, Inc.",,25,MA,"MAKE A MOVE, MAKE AN IMPACT.  a.i. solutions was founded over 25 years ago with a mission to MAKE AN IMPACT by exceeding expectations. A move to our team means using your passion and ingenuity to MAKE AN IMPACT through innovations, defending national security, and enabling access to space. MAKE A MOVE, to join a team driven by a shared ambition, and rewarded for individual contributions.  BENEFITS THAT MAKE AN IMPACT:  Zero $$ Group Health Plans Zero $$ Mental Health Therapy Paid Parental leave for Mom & Dad Paid Time Off w/Flex scheduling - create the work/life balance that works for you 401k Safe Harbor Plan, we contribute on Day #1 Wellness plans that rewards wellbeing & work life harmony Career development and growth, and endless learning opportunities Engaged and supportive leadership that cares   Essential Roles & Responsibilities:  Provide technical expertise in software quality assurance to the government for the assigned programs. Participate in cross-functional teams conducting software quality evaluations, audits and assessments, for existing and developmental missile defense programs. Activities include providing on-site verification and auditing at Developer facilities to ensure that robust controls are in place for quality assurance practices. Participate and provide input for Software Review Boards, failure investigations and failure review boards. Activities include determining root cause of failures of MDA hardware and software. Participate in assessments, tests, or technical interchange meetings to assess processes and practices for compliance with software quality assurance strategies, policies, and standards. Report results. Activities include providing on-site verification and auditing at Developer facilities to ensure that robust controls are in place for quality assurance practices. Participate in technical meetings and independent software code reviews for software (including but not limited to agile/iterative) development efforts to assess compliance with industry-wide and MDA software quality assurance standards and best practices. Report results. Assess software (including but not limited to agile/iterative software development model) quality assurance to include requirements, design, development, testing, and deployment activities. Demonstrated experience in the following: Leading and executing extensive software quality engineering support efforts for complex weapon systems, system elements, interfacing systems, components, devices and/or processes for missile defense programs. Software quality processes and products from requirements phase through testing and fielding Leading the implementation of software quality engineering. Travel periodically (approximately three times per year for 2-4 days per trip) Position is located at MDA facility on Redstone Arsenal with expectation to work onsite 4 days per month. Otherwise telework from home is authorized when not required to be onsite   Minimum Qualifications:  Bachelor’s Degree in Professional engineering from a school of engineering Accreditation Board of Engineering and Technology, Inc. in software engineering with a minimum of 10 years of experience in software engineering field. Acceptable substitute to ABET requirement: is a Degree and 12 years of experience in a software field. Current Secret Security Clearance or the ability to obtain prior to start required. U.S. Citizenship  Equal Opportunity Employer/Protected Veterans/Individuals with Disabilities The contractor will not discharge or in any other manner discriminate against employees or applicants because they have inquired about, discussed, or disclosed their own pay or the pay of another employee or applicant. However, employees who have access to the compensation information of other employees or applicants as a part of their essential job functions cannot disclose the pay of other employees or applicants to individuals who do not otherwise have access to compensation information, unless the disclosure is (a) in response to a formal complaint or charge, (b) in furtherance of an investigation, proceeding, hearing, or action, including an investigation conducted by the employer, or (c) consistent with the contractor’s legal duty to furnish information. 41 CFR 60-1.35(c)"
