URL,Location,Company,Employment Type,Years of Exp,Education Level,Data
"https://www.glassdoor.com/job-listing/entry-level-software-engineer-c-integration-innovation-inc-JV_IC1127653_KO0,31_KE32,58.htm?jl=1009097751787",Alabama,"Integration Innovation, Inc.",,3,,"Overview:  i3 is seeking a Software Engineer to develop cutting edge training and simulation for the US Army MQ-1C Gray Eagle Uncrewed Aerial System (UAS)'s next generation simulation and trainer. This project uses modern .NET/C# libraries including Blazor and SignalR. This project provides a unique opportunity to develop a new product from the ground up and enhance your front-end and back-end skillsets. Responsibilities: Candidate will develop software designs using best practices and object-oriented methodologies. Software will be developed using an agile-scrum development style. Integrating third-party libraries and applications into the overall system. Routine collaboration with team members in developing system capabilities. The candidate will be familiar with good configuration management practices and will be responsible for proper code maintenance, merging, and configuration management. Position Location: Huntsville, AL CONUS Travel required: Less than 10% Qualifications: Required Experience Have a Bachelor’s degree (or advanced degree) from an accredited college (ABET preferred) in computer science, engineering, mathematics, or the hard sciences, with 0-3 years of professional experience. Additional years of experience may be substituted for degree. Experience (academic or professional) in at least one programming language such as C#, C++, Java, or Python. Have experience with an agile development methodology and associated tools. Have experience with a configuration management software tool. Security Clearance: Candidate must have the ability to obtain a SECRET security clearance. Preferred Experience Experience developing software in C#. Familiarity with git for software source control and configuration management. Experience with virtualization technologies like Docker, Podman, or VmWare. Familiarity with UAS Command and Control Protocols like STANAG-4586 and FACE. Experience developing 6-DOF Aircraft simulation models is a plus. Communicating with third-party applications using low level messages via UDP/TCP or higher-level protocols such as gRPC. Experience with Image and Scene Generator protocols and tools like CIGI, VRSG, and BlueIG. Familiarity with basic design patterns like the repository, factory, and decorator patterns. About i3:  Headquartered in Huntsville, AL, i3 is a national leader in providing innovative technical and engineering solutions to a broad customer base across the U.S. DoD. Specializing in missile and aviation engineering and logistic services, electronic warfare and electromagnetic affects analysis, UAS system integration and flight operations, full lifecycle C5ISR engineering services, engineering analysis, cybersecurity and IT/IA innovative solutions and virtual training, simulation & serious game development and implementation. We were founded in 2007 with the intent to do business differently. Our focus is to leave our team members, our customers and our communities better than we found them. Our ultimate goal is to strengthen our Nation and our warfighter. Perks and Benefits at i3: 100% team member owned Outstanding insurance coverage 401(k) match Health and wellness incentives Tuition and certification reimbursement Generous PTO Fun culture with company activities Countless opportunities to give back to the community through our charitable organization, i3 Cares We work hard. We compete hard. We play hard. Apply now to join us!"
"https://www.glassdoor.com/job-listing/software-engineer-pradco-outdoor-brands-JV_IC1127429_KO0,17_KE18,39.htm?jl=1009111599758",Alabama,PRADCO Outdoor Brands,Remote,2,,"PRADCO Outdoor Brands (PRADCO) manufactures and markets major hunting and fishing brands and products. We are a leader in producing game calls, scents, attractants, game feeders, game cameras, tree stands and fishing lures. PRADCO Hunting owns the brands Moultrie, Summit, Knight & Hale, Code Blue, Texas Hunter Products and Whitetail Institute. PRADCO Fishing owns more than 20 brands including Bobby Garland, Booyah, Heddon, Lindy, Rebel, Thill, and YUM. For more information on PRADCO products, please visit our website at www.pradcooutdoorbrands.com. PRADCO team members participate in a selection of outstanding benefits, including: Profit Sharing Trust, Excellent Medical/Dental/Drug/Vision benefits, and many other benefits. Job Summary PRADCO is looking for a Software Engineer to contribute to its growing e-commerce business. The engineer will be supporting our e-commerce platform by updating the application, writing HTML, CSS and JavaScript for customer facing storefront features as well as writing backend code to integrate the platform with other systems. The position is a well-rounded role providing experience in the many layers of web software development. The Software Engineer position is a great opportunity to hone skills in many areas of web development, platform security and project management. The position is available for remote work, providing flexibility in time management and location. If you want to grow with a small team as we expand the capabilities of our business, please apply. Job Responsibilities Install platform and security updates for our Adobe Commerce (Magento) installation. Provide application support to the PRADCO team members that use the e-commerce platform. Write HTML, CSS and JavaScript frontend code for storefront pages. Write PHP backend code to integrate with other internal and 3rd-party systems. Maintain the security of the e-commerce platform to protect customer data, prevent fraudulent activity and continue PCI compliance. Communicate clearly with project stakeholders about task requirements and finished features. Manage assigned tasks using Kanban project management. Submit code using Git version control. Job Requirements Bachelor’s degree in information systems, computer science or related field of study, or equivalent software development experience. A minimum of 2 years’ experience with proficiency in: Object-oriented programming using a programming language like PHP, Java, C# or C++. Writing web frontend code using HTML, CSS and JavaScript. Using Git version control or other equivalent tools. Ability to work business hours in the North American Central time zone. Preferred Skills Experience using Adobe Commerce (Magento) preferred, but not required. Essential Job Functions Outstanding organizational, interpersonal and communication (written and verbal) skills. Strong analytical and problem-solving skills May require sitting for long periods of time in an office environment. Ability to see where process improvements can be made either through observation of processes or from communication with users and offer solutions to bring those improvements to life We are an equal opportunity employer and comply with all applicable federal, state, and local fair employment practices laws. We strictly prohibit and do not tolerate discrimination against employees, applicants, or any other covered persons because of race, color, sex, pregnancy status, age, national origin or ancestry, ethnicity, religion, creed, sexual orientation, gender identity, status as a veteran, and basis of disability or any other federal, state or local protected class. This policy applies to all terms and conditions of employment, including, but not limited to, hiring, training, promotion, discipline, compensation, benefits, and termination of employment. We comply with the Americans with Disabilities Act (ADA), as amended by the ADA Amendments Act, and all applicable state or local law."
"https://www.glassdoor.com/job-listing/associate-controls-software-engineer-pa-solutions-JV_IC1127428_KO0,36_KE37,49.htm?jl=1009082923664",Alabama,PA Solutions,Flexible,not given,,"Job Description Required Duties: The candidate must be able to work in a professional engineering team-based environment. Engineering teams are responsible for the design and integration of control systems for customer applications and processes. Duties may include and are not limited to PLC and HMI programming, network design, system commissioning, system support, internal/external training, and technical consultation. Areas of focus are controls standardization. Candidate Responsibilities / Must also possess the following traits: Logical thinker & problem solver Organized & detail oriented Strong verbal and written communication skills Self-motivated with “can do” mindset Strong leadership skills Team player with emphasis on team development Innovative regarding new processes and development aids Budget and deadline aware Must be willing to travel up to 70% Must be willing to work long hours on various shift models Specific Responsibilities: The following lists are general responsibilities that may vary from customer to customer. Developing standardize code & development tools, including: Creating PLC/HMI/Diagnostic Libraries (AOIs, FBs, UDT, Faceplates, etc.) Creating Quality Check Tools – used to validate standards were properly executed Creating Process for Standards deployment including input/outputs of deliverables and utilizing check-in/check-out and sign-off procedures to ensure Quality and Timing Milestones are met Secondary: Participate in Design Reviews and support customer meetings proactively Train team members on project standards as applicable Plan to execute work within budget, with exceptional quality (FTR), and on time Track and report metrics as required Forecast time/resources to complete remaining work Participate in continuous improvement initiatives and champion outcomes of the initiatives. Supervise activities of functionally assigned personnel, applying knowledge of automation concepts and procedures and production area knowledge Execute, supervise, and verify all works aligns to customer specifications and expectations. Apply special knowledge of automation, controls engineering, and robotics where applicable Travel to customer sites as necessary for the betterment of assigned team or to personally deliver optimal solutions Additional Information Technical Skills: PLC Programming Rockwell – Studio5000, RSLogix 5 Siemens – TIA Portal V15+, Step 7 HMI Design: Rockwell – RS/FT View ME/SE Siemens – TIA Portal Advanced, WinCC Flexible/SCADA Computer Programming: Experience in one or more of the following: Visual Basic, C++, C#, Java, Python, etc. General Networking - Ethernet troubleshooting and design of various hardware types and configurations Network Address Translation VLANs Various Network Topologies (Star, Linear, Ring…) Business Software - Produce documentation, calculations, and presentations Microsoft Office: Hardware Design: Understand electrical, pneumatic and water schematics and complete the integration of industrial automation systems Education and Experience: Bachelor’s degree in a controls related field (Electrical Engineering, Computer Engineering, Computer Science or equivalent) One to three plus years of applicable experience in an industrial environment that includes design, debug, startup, and production-readying of industrial controls equipment. Must have knowledge of multiple customer platforms. Experience must include complete knowledge of full project lifecycle HSE All employees have the responsibility to work in a safe manner and report any health, safety or environmental concern to their manager or supervisor in a timely manner. Employee responsibilities for Health, Safety and Environment include: Work in compliance with divisional health, safety and environmental procedures Refrain from removing or altering safety devices or guarding unless hazardous energies are controlled through lockout-tagout methods Report any unsafe conditions or unsafe acts Report defect in any equipment or protective device Ensure that the required protective equipment is used for the assigned tasks Attend all required health, safety and environmental training Report any accidents/incidents to supervisor Assist in investigating accidents/incidents Refrain from engaging in any prank, contest, feat of strength, unnecessary running or rough and boisterous conduct Join the Winning Team at PA Solutions, Inc. (a global division of ATS Automation). We help exceptional customers automate their manufacturing as Tooling System Integrators. We work with Global OEM's/Tier suppliers supporting transportation and aerospace industries. Take your place among the best in the business and grow your career with PA Solutions, Inc. Join an environment where a passion for innovation is combined with an uncompromised commitment to quality. PA Solutions, Inc. offers a superior benefits package designed with you in mind! If you would like to automate your future, check us out and be a part of our unprecedented growth! All qualified applicants will receive consideration for employment without regard to race, color, religion or belief, national, social or ethnic origin, sex (including pregnancy), age, physical, mental or sensory disability, HIV status, sexual orientation, gender identity and/or expression, marital, civil union or domestic partnership status, past or present military service, family medical history or genetic information, family or parental status, or any other status protected by the laws or regulations."
"https://www.glassdoor.com/job-listing/software-developers-junior-positions-gps-it-solutions-JV_IC1127776_KO0,36_KE37,53.htm?jl=1005685503346",Alabama,GPS IT Solutions,,2,,"GPS IT Solutions currently has the following openings to work at various customer sites throughout the USA. Applicants must be willing to travel and/or relocate.  Qualified and interested professionals are requested to Respond with resume and contact details to hr@gpsitsolutions.com . GPS IT Solutions. is seeking Software Developers in Tuscaloosa, AL to analyze user requirements, design, develop, test, and deploy various software applications under supervision of Sr. Software Developers. Requirements: BS or foreign equivalent in Comp. Sc./IT/Engg. /Math or related plus 2 years of relevant IT using Java, Microsoft SQL Server, .NET and Salesforce. Positions required travel to various unanticipated locations in the United States.  Please submit resume to: hr@gpsitsolutions.com"
"https://www.glassdoor.com/job-listing/gmd-weapons-system-gws-gni-cyber-devsecops-software-engineer-lockheed-martin-corporation-JV_IC1127653_KO0,60_KE61,88.htm?jl=1009104957092",Alabama,Lockheed Martin Corporation,"Fulltime, Flexible, Hybrid, Remote",5,Master,"JOB ID: 660760BR Date posted: Feb. 01, 2024  Description:What We're Doing As a part of the Lockheed Martin community, we take on challenges and find solutions using creativity and collaboration. If you’re looking to be a part of a passionate team solving these complex problems, then Rotary and Mission Systems is the place for you.  The Work Ground Missile Defense (GMD) is the heart of the Missile Defense System and a key element of our nation’s defense against ballistic missile attacks. The GMD Weapon System processes data from multiple sensors to identify and characterize the inbound ballistic missile threat, plans the best defensive solution, and launches the intercepting missiles to negate the threat. This role will provide DevSecOps engineering support to the GWS GNI program. The candidate will work directly with SW development teams to develop Infrastructure as code scripts in Terraform and Helm and maintain applications on Kubernetes clusters. Responsibilities include configuring and maintaining DevSecOps Continuous integration/Continuous Deployment (CI/CD) pipeline tools.  Due to the nature of the role, this is not being offered as a teleworking or hybrid position.  This position requires an Active DoD Secret Security Clearance.  Why Join Us  Your Health, Your Wealth, Your Life Our flexible schedules, competitive pay and comprehensive benefits enable you to live a healthy, fulfilling life at and outside of work.  Basic Qualifications: Bachelor’s Degree in a STEM (Science, Technology, Engineering or Mathematics) discipline from an accredited college and 5 years of related experience, or a Master's Degree in a STEM discipline and 3 years of related experience GWS Program experience Experience and skills in agile software principles, particularly with regard to building a plan or roadmap for multiyear program / product Must have a DOD 8570 IAT Level II certification (ex: Security + CE) Utilization of Agile practices and principles to deliver high quality products and services Experience with software development (i.e., Java/JavaScript, C++, C#, or any modern object-oriented language) and its life cycle to support DevSecOps Interest and aptitude in developing Infrastructure as code scripts in Terraform and Helm to provision cloud resources Deploying and maintaining applications on Kubernetes clusters Configuring and maintaining DevSecOps Continuous Integration/Continuous Deployment (CI/CD) pipeline tools Effective communication skills, both internally and externally to team Eagerness to expand knowledge and continually improve. Active DoD Secret Security Clearance Desired Skills: Agile knowledge Atlassian tool set experience Security Clearance Statement:This position requires a government security clearance, you must be a US Citizen for consideration. Clearance Level:Secret Other Important Information You Should Know Expression of Interest:By applying to this job, you are expressing interest in this position and could be considered for other career opportunities where similar skills and requirements have been identified as a match. Should this match be identified you may be contacted for this and future openings. Ability to Work Remotely:Onsite Full-time: The work associated with this position will be performed onsite at a designated Lockheed Martin facility. Work Schedules:Lockheed Martin supports a variety of alternate work schedules that provide additional flexibility to our employees. Schedules range from standard 40 hours over a five day work week while others may be condensed. These condensed schedules provide employees with additional time away from the office and are in addition to our Paid Time off benefits. Schedule for this Position:9x80 every other Friday off Lockheed Martin is an Equal Opportunity/Affirmative Action Employer. All qualified applicants will receive consideration for employment without regard to race, color, religion, sex, pregnancy, sexual orientation, gender identity, national origin, age, protected veteran status, or disability status. The application window will close in 90 days; applicants are encouraged to apply within 5 - 30 days of the requisition posting date in order to receive optimal consideration. At Lockheed Martin, we use our passion for purposeful innovation to help keep people safe and solve the world's most complex challenges. Our people are some of the greatest minds in the industry and truly make Lockheed Martin a great place to work.   With our employees as our priority, we provide diverse career opportunities designed to propel, develop, and boost agility. Our flexible schedules, competitive pay, and comprehensive benefits enable our employees to live a healthy, fulfilling life at and outside of work. We place an emphasis on empowering our employees by fostering an inclusive environment built upon integrity and corporate responsibility.  If this sounds like a culture you connect with, you’re invited to apply for this role. Or, if you are unsure whether your experience aligns with the requirements of this position, we encourage you to search on Lockheed Martin Jobs, and apply for roles that align with your qualifications. Experience Level:Experienced Professional Business Unit:RMS Relocation Available:Possible Career Area:Software Engineering Type:Full-Time Shift:First At Lockheed Martin, we apply our passion for purposeful innovation to keep people safe and solve the world's most complex challenges. Mission-Focused Innovation: From aerospace to outer space to cyber space, you can solve the world's most complex challenges for our customers. Foundational Values: Our culture of performance excellence, ethics, teamwork and inclusion is embedded in everything we do. Diverse Career Opportunities with Meaningful Work: Grow your career and skills for life. Our technology-driven learning platforms and programs enable your development and agility. Your Health, Your Wealth, Your Life: Our flexible schedules, competitive pay and comprehensive benefits enable you to live a healthy, fulfilling life at and outside of work. Empowered to Be Your Best: Use your strengths to make a difference in the lives of one another, our customers, our communities and our planet. Commitment to Sustainability: We foster innovation, integrity and security to preserve the environment, strengthen diverse communities and propel growth. Here, the possibilities are endless because we offer: Flexible Schedules, dependent on role Levels: Student, Entry, Mid, Senior, Management Locations: Nationwide & OCONUS Positions"
"https://www.glassdoor.com/job-listing/entry-level-software-engineer-torch-technologies-inc-JV_IC1127653_KO0,29_KE30,52.htm?jl=1009059833616",Alabama,Element with the specified ID not found.,,not given,,Element with the specified ID not found.
"https://www.glassdoor.com/job-listing/web-developer-html-javascript-web-templates-online-commerce-group-ocg-JV_IC1127704_KO0,43_KE44,69.htm?jl=1009075018370",Alabama,Online Commerce Group (OCG),"Parttime, Remote",not given,,"LOCATION Montgomery, Alabama or Part-Time Remote (For hire or contract)  JOB DUTIES Collaborate with the design team to implement responsive and user-friendly web templates using HTML and CSSDevelop interactive and dynamic web interfaces using JavaScript and related frameworksCustomize and integrate web templates, ensuring consistency and seamless user experienceOptimize web applications for maximum speed and scalabilityTroubleshoot and debug issues across different browsers and devicesStay up-to-date with emerging web development trends and technologies  JOB REQUIREMENTS Proven experience as a Web Developer with a portfolio showcasing relevant projectsProficiency in HTML and JavaScript (any version)Familiarity with web templates and frameworks (e.g., Bootstrap, Foundation, etc.)Understanding of responsive design principlesExperience with cross-browser compatibility and debuggingProblem-solving skills and an ability to think creativelyExcellent communication and collaboration skills  Not Required (but helpful) Experience with Magento or WordpressExperience with Google Analytics or Adobe Analytics  To apply for this position, submit your resume to jobs@onlinecommercegroup.com."
