URL,Location,Company,Employment Type,Years of Exp,Education Level,Data
"https://www.glassdoor.com/job-listing/mid-level-software-engineer-peopletec-inc-JV_IC1127653_KO0,27_KE28,41.htm?jl=1009108204873",Alabama,"PeopleTec, Inc.",,16,,"Responsibilities:  PeopleTec is currently seeking a Mid-Level Software Engineer to support our Huntsville, AL location. PeopleTec is seeking a Mid-Level Software Engineer to support the PEO M&S STORM PO SW Division. Candidate must possess SW engineering expertise understanding the SDLC lifecycle and Agile practices. Responsibilities include managing software projects to include: Software reviews Support agile events (sprint reviews, backlog grooming, sprint demonstrations, etc.) Azure DevOps experience DevSecOps project support Testing support (V&V) Candidate is expected to support all project milestone reviews Documentation reviews Software code reviews Tracking of contract deliverables Manage cost, schedule, and performance Tracking project metrics Qualifications: Required Skills/Experience: Desired project management expertise Candidate must be a team player and willing to work across multiple teams Excellent written and oral communication skills. Develop and brief project presentations and status Travel: 10 % Must be a U.S. Citizen An active DoD Secret clearance is required to perform this work. Candidates are required to have an active Secret clearance upon hire, and the ability to maintain this level of clearance during their employment. Education Requirements: BS degree, Computer Science, Computer Engineering, Information Systems, Minimum 16 years experience BS degree Computer Science or equivalent Overview:  People First. Technology Always. PeopleTec, Inc. is an employee-owned small business founded in Huntsville, AL that provides exceptional customer support by employing and retaining a highly skilled workforce. Culture: The name ""PeopleTec"" was deliberately chosen to remind us of our core value system - our people. Our company's foundation was built on placing our employees and customers first. With an award-winning atmosphere, we have matured into a company that boasts the best and brightest across multiple technical fields. Career: At PeopleTec, we value your long-term goals. Whether it's through our continuing-education opportunities, our robust training programs, or our ""People First"" benefits package, PeopleTec truly believes that our best investments are our people. Come Experience It. #cjpost #dpost EEO Statement PeopleTec, Inc. is an Equal Employment Opportunity employer and provides reasonable accommodation for qualified individuals with disabilities and disabled veterans in its job application procedures. If you have any difficulty using our online system and you need an accommodation due to a disability, you may use the following email address, applicationhelp@peopletec.com and/or phone number (256.319.3800) to contact us about your interest in employment with PeopleTec, Inc. All qualified applicants will receive consideration for employment without regard to race, color, religion, sex, sexual orientation, gender identity, national origin, age, genetic information, citizenship, ancestry, marital status, protected veteran status, disability status or any other status protected by federal, state, or local law. PeopleTec, Inc. participates in E-Verify."
"https://www.glassdoor.com/job-listing/software-engineer-uda-technologies-JV_IC1127412_KO0,17_KE18,34.htm?jl=1008517942228",Alabama,UDA Technologies,Fulltime,not given,,"UDA Technologies is seeking individuals who want to join us in developing a suite of web services and integrated project management software applications used by over 850,000 users across 75 countries. Selected individuals will work in the Auburn office with our software development, sales, graphic design, and marketing teams to develop and advance UDA Technologies products. In this role, you will work in an environment where diverse perspectives are invited, the best ideas are valued, and people feel empowered to contribute.  Ideal candidates will have a software engineering, computer science, or related background, have a mature and outgoing personality, excellent communication skills, plus working knowledge in web development, content management, Visual Studio, ASP.NET, JavaScript, C#, SQL Server, HTML, CSS, AJAX, JSON, XML, JQuery, RESTful API, server maintenance and deployment techniques. Don’t be discouraged if you aren’t familiar with some of the technologies listed, as we are here to help you learn these skills and grow as a developer as during your time at UDA Technologies.  Responsibilities: Develop, document, and maintain product application source code Review and debug product application source code to maintain quality control standards Develop new components for growing software suite Provide advanced application support Track and perform server maintenance and optimization tasks Evaluate customer needs and provide feedback for new product features Analyze and improve software development plan and procedures Participate in analyzing and planning new opportunities and markets for software Requirements: B.S. in software engineering, computer science, or related degree (for full time positions) Working knowledge of Visual Studio, Microsoft SQL Server, network protocols, and JSON Knowledge of front end web development practices and experience using Javascript, HTML, and CSS Excellent communication skills Understanding of software development cycles Ability to plan for and meet development deadlines Must be self-motivated, willing to learn and adapt to new situations, and focused on customer need The Following are Considered a Plus: Previous code contributions in open source projects or code samples from GitHub Knowledge and experience with web and/or mobile app development Coding experience in languages/technologies like: jQuery & AJAX Visual Basic (VB.NET) and ASP>NET Development C# and ASP.NET API Development Visual Studio for >NET development Aspose Apitron PDF Amazon S3 API TX Text Control Proficient with a modern source control tool (Git is preferred) Benefits (Full Time): Excellent salary 401K Retirement Plan Flex Time opportunities to engage in personal projects on company time Profit-sharing BlueCross BlueShield health and dental coverage 2 weeks Paid Vacation, plus Major Holidays Discounted health club membership Extensive opportunities for career advancement Friendly office environment Salary Range:  Starting salary from $65,000 - $85,000 per year, plus benefits and bonuses  Rank and salary will be commensurate with experience and qualifications.  Benefits include excellent salary, 401K, profit-sharing, BlueCross BlueShield health and dental coverage, vacation, holidays and sick leave, discounted health club membership, opportunities for career advancement, and friendly office environment.  For additional job opportunities, visit UDA Technologies' Careers Page"
"https://www.glassdoor.com/job-listing/test-automation-software-engineer-abaco-systems-JV_IC1127653_KO0,33_KE34,47.htm?jl=1009082526114",Alabama,Abaco Systems,Permanent,30,,"Location: Huntsville, AL, US, 35808 Business Unit: Abaco Business Unit Posting Date: Jan 19, 2024 Job Description: Abaco Systems is a global leader in commercial open architecture computing and rugged embedded electronics. With more than 30 years of experience in aerospace & defense, industrial, energy, medical, communications and other critical sectors, Abaco’s innovative solutions align with open standards to accelerate customer success. Abaco Systems is a business unit of AMETEK, Inc., a leading global manufacturer of electronic instruments and electromechanical devices with 2021 sales of more than $5.5 billion.  Abaco Systems is seeking a Test Automation Software Engineer with experience in test software development and product qualification. We are interested in a highly motivated, hands-on, engineer with a proven record of success in development through implementation phases of test. The test engineering team is comprised of fast paced developers of ruggedized product test solutions, supporting a global company providing turnkey and off the shelf products for the defense and science industries. Join us in a collaborative hands-on environment that fosters engineering excellence, creativity, and innovation.  Role Responsbilities:  Develop and maintain automated test sequences, software, firmware, and scripts to validate our products during development through manufacturing Collaborate with product development teams to develop software, requirements, and plans Work closely with our engineering and production departments to validate solutions as they are deployed in product qualification and manufacturing environments Communicate status to key stakeholders in a timely and professional manner Produce internal documentation for assigned tasks consistent with engineering processes and procedures  Skills & Competencies: Understanding of C/C++ Experienced in writing test software at hardware/driver level Understanding of Windows and Linux Understanding of Python, Bash, and other scripting languages Problem-solving and creative, solution-building skills Verbal and written communication skills Approaches assigned tasks methodically from start to finish Ability to work successfully in a team environment Desire and ability to work outside of the known areas of expertise Motivated, with the ability to make decisions and solve problems with minimal supervision Awareness of computer architectures and hardware designs Working knowledge of peripheral interfaces and protocols such as PCI/PCIe, USB, SATA, SPI, I2C, Ethernet, and Video (DVI, VGA, Display-Port, etc.) An awareness of NI tools LabVIEW and TestStand  Education & Experience: Bachelor's Degree in Electrical Engineering, Computer Engineering, Computer Science, or other relevant fields 1-2 years of experience in software development in Python and C/C++ Ability and willingness to travel up to 10% as required  Abaco is a Department of Defense (DoD) supplier and as such employees may work with or be exposed to controlled information that may only be seen or handled by US citizens or qualified permanent residents. Compensation Salary Minimum: Market Salary Maximum: Market Incentive: No Disclaimer: Where a specific pay range is noted, it is a good faith estimate at the time of this posting. The actual salary offered will be based on experience, skills, qualifications, market / business considerations, and geographic location. AMETEK is committed to making a safer, sustainable, and more productive world a reality. We use differentiated technology solutions to solve our customers’ most complex challenges. We employ 18,500 colleagues, in 30 countries, that are grounded by our core values: Ethics and Integrity, Respect for the Individual, Diversity and Inclusion, Teamwork, and Social Responsibility. AMETEK is a leading global provider of industrial technology solutions serving a diverse set of attractive niche markets with annual sales of over $6.0 billion. Traded publicly (NYSE:AME), we are a component of the S&P 500. Visit www.ametek.com for more information. We are an Equal Opportunity Employer and do not discriminate against any employee or applicant for employment because of race, color, sex, age, national origin, religion, sexual orientation, gender identity, status as a veteran, and basis of disability or any other federal, state or local protected class. Individuals who need a reasonable accommodation because of a disability for any part of the employment process should call 1 (866) 263-8359.  Nearest Major Market: Huntsville"
"https://www.glassdoor.com/job-listing/software-engineer-ierus-technologies-inc-JV_IC1127653_KO0,17_KE18,40.htm?jl=1009018211082",Alabama,Element with the specified ID not found.,,not given,,Element with the specified ID not found.
"https://www.glassdoor.com/job-listing/rpg-programmer-maples-industries-inc-JV_IC1127727_KO0,14_KE15,36.htm?jl=1008798364582",Alabama,"Maples Industries, Inc.",,10,,"The RPG Programmer position will work with a team to develop and modify software applications including coding, testing, and involvement in system management. Essential Functions: Work with users and management to find best solutions in designing applications. Code new programs and enhance existing programs. Document modifications made to programs. Test and debug new and/or modified programs to ensure quality. Resolve data issues by analyzing code and procedures. Maintain IBM iSeries system configurations. Other duties as assigned by management.  Education and/or Experience: Bachelor's Degree preferred. Minimum of 10 years programming and Systems Design experience using RPG languages (RPG, PRGLE, RPG III, RPG IV and RPG Free)on IBM iSeries platform. Knowledge of SQL, Embedded SQL, Visual Programing (Visual RPG) is a plus. Experience working with interfacing AS400 with web applications is a plus.  Language Skills Ability to read and interpret documents such as safety rules, operating and maintenance instructions, and procedure manuals. Must have good communication skills. Reasning Ability Must have strong analytical and problem solving abilities. Must have good communication skills.  Licenses/Certificates: Valid Driver's License required."
"https://www.glassdoor.com/job-listing/program-level-software-systems-engineer-intrepidllc-JV_IC1127653_KO0,39_KE40,51.htm?jl=1009081155542",Alabama,IntrepidLLC,"Flexible, Remote",not given,,"Intrepid sets the standard for delivering excellence in the federal marketplace and is known for treating employees like family. We provide our employees with a challenging and supportive work environment, paired with a competitive salary and an industry-leading 401k contribution. We are looking for a Program-Level Software Systems Engineer to join our team to support the IFMC AMD Mission Command Product Office, a government program office addressing Army Air and Missile Defense systems, with focus on Mission Command systems. The candidate in this role will work with both contractors, government civilians and system operators. Your day-to-day work will include: Developing system level features that describe MEI and CSCI behavior, performance, and acceptance criteria necessary to provide guidance for software implementation. Leading reviews and adjudicating comments made against the features. An MBSE approach is used to document the features using an Agile workflow. At a minimum you should have: Must be a US Citizen and a resident of the Huntsville, AL area or be willing to relocate to the Huntsville, AL area. A bachelor’s degree in engineering, science, or related field is required. 7 or more years of system engineering experience. Experience in one or more of the following areas: tactical command and control systems, tactical weapons systems, tactical sensor systems, software, hardware, requirements decomposition, or MBSE tools and languages A solid theoretical and applied knowledge of Link-16. Experience with integration of MIDS terminals via ethernet interfaces is highly desired. A record of taking initiative and being a team player in a small team environment. Must be comfortable working as a team member in an Agile environment and be willing to engage various levels of stakeholders to ensure that software can meet the needs of the intended users. Must be highly organized with a strong technical background in system engineering principles. System engineering experience in support of DoD programs is highly desired, especially in an Army Air and Missile Defense program. Hands on experience creating models in Cameo or MagicDraw using SysML and UAF are desired. Experience using Atlassian tools such as Jira and Confluence and SAFe© Agile experience are plus. Must be able to acquire or possess (as well as maintain) a US SECRET security clearance.  **This job description is subject to change at any time. Work Type: On-Site (Huntsville, AL) Estimated Salary Range: $116,000-$134,000 The provided salary range serves as a broad reference. However, Intrepid takes various factors into account when establishing base salary offers, including the position's scope and responsibilities, as well as the candidate's experience, education, skills, and prevailing market conditions. Work/Life at Intrepid Wondering what it's like to work here? Let us give you a glimpse of our exceptional workplace culture. Our employees have consistently nominated us for the Best Places to Work award and we take pride in our family-like environment, remarkable benefits, and go-the-extra-mile attitude. The Hours We sincerely value work-life balance. Our flexible-hours policy allows you to balance extra time during significant projects with days that are lighter. Moreover, we offer generous accrual of paid personal leave that doesn’t lose its value (no use it or lose it here!) as well as 11 paid holidays per year. The Benefits Our benefits are renowned, starting with our outstanding 401k program. No match required! We contribute 14% of your bi-weekly pay to your account regardless of your contribution. With our low-fee index funds from Fidelity, your retirement savings will grow substantially. Plus, your professional financial advisors are already covered! Our top-notch health insurance plan through Blue Cross Blue Shield includes low deductibles ($200/year) and is mostly covered by Intrepid, or you can choose a high-deductible plan with an eligible HSA, the choice is yours! We also provide complimentary life insurance, affordable dental, vision, disability, critical illness, and pet insurance. Additionally, you can set aside pre-tax dollars for medical and dependent care expenses through an FSA. We even offer a $1000 scholarship for newborn or adopted children, as well as those enrolled in higher education. The Perks Enjoy typical perks like corporate discounts as well as unique experiences as an Intrepid employee. You'll be a VIP at our annual events, including the Chili Cook-Off, Thanksgiving Lunch & Lawn Games, Ice-Cream Social, Intrepig BBQ, and the grand end-of-year Christmas bash with amazing prizes! Remote workers have special virtual engagement opportunities and exclusive events so no one is left out of the fun. Give Back Giving back is ingrained in our values. Through our employee-managed charitable fund, the Intrepid Ideal Community Fund (ICF), we contribute tens of thousands of dollars each year to organizations that help people in need. Join us in various volunteer opportunities and help us make a difference in our communities. Our vision is to one day create ideal communities where every citizen's needs are met. Join Us! There's something for everyone at Intrepid. If our benefits, perks, values, and mission resonate with you, we're thrilled to meet you! Start your journey as an Intrepid employee by applying today. We can't wait to hear from you! About Intrepid: Intrepid is a VEVRAA Federal Contractor and an Equal Opportunity Employer, committed to making employment decisions based on merit and value. All qualified applicants will receive consideration for employment without regard to race, color, religion, sex, sexual orientation, gender identity, national origin, disability, or status as a protected veteran. #CJ"
"https://www.glassdoor.com/job-listing/senior-qa-automation-engineer-playrix-JV_IC1127676_KO0,29_KE30,37.htm?jl=1009067419218",Alabama,Playrix,"Flexible, Hybrid, Remote",19,,"Playrix is one of the most successful mobile game development companies in the world. We rank in the top 3 in the world in terms of revenue and in EMEA we are first in terms of revenue among all mobile applications. Our games have been installed 2.3 billion times (which is equal to a third of the world's population), and more than 30 million people around the worldour games every day. We have big plans for the development and growth of our projects, and we pay special attention to the quality of our products, which is why we are looking for the strongest experts to join our testing teams. For us, testing teams are an important part of the company. It is thanks to them that our games have been functioning well and developing for 19 years, and our players notice this special quality. Each QA makes a unique contribution to the company's results. Now we are heading towards developing automation within all of our products.     This role requires relocation from Russia and Belarus to one of our offices or remote work from other countries (except Russia and Belarus). Tasks  Participate in testing a complex product Unity-like engine and editor; Develop and support automated tests in Python; Improve and support the automation framework; Analyze test scenarios for their readiness for automation; Participate in code-review autotests; Participate in communication with manual testing teams. Our stack Autotests in Python; A self-written framework, plus we useand integrate reports on test runs directly into TMS; We manage tasks and defects in store the test model in manage the code in QASE, manage the code in Git, CI/CD in TeamCity.    Requirements 4+ years of experience in AQA; Knowledge of Python and the main libraries used in test automation; Experience with Allure (preferred); Experience with Pytest, Selenium; Experience writing frameworks for automated testing; Experience with TMS; Experience with CI/CD solutions, Git; Understanding of how software development works Understanding of the software life cycle. Our Perks We offer An opportunity for continuous professional growth in a large engine team. We also have a huge knowledge base and a mentoring system that allows you to adapt quickly The ability to switch out processes and approaches for more efficient ones without lengthy approvals or bureaucracy The opportunity to shift into development and take on non-standard tasks There is an opportunity to develop in the direction of Performance automation There are tasks to develop and refine a self-written framework in/li>  Our Perks A flexible schedule We have a flexible work schedule — we only focus on results and do not count hours worked. Workplace options Work from wherever you like — your home, one of our many offices, or a hybrid combination. We have everything you need to be comfortable while working, wherever you may be. Healthcare We compensate online sessions with a psychologist, and offer you and your children health insurance including dental. Work-life balance We offer fully paid vacation days and sick leave. In special circumstances, you can also request additional days off. Entertainment and merch Every year we hold hundreds of events worldwide, including contests, sports challenges, parties, hackathons, and offline events for individual teams. Sports and fitness We support our employees leading a healthy lifestyle and offer reimbursement for gym membership or fitness app subscriptions. Community involvement We launch charity projects and support our employees' initiatives through our grant competition. Relocation package We assist employees, their families, and their pets with relocation, and also arrange concierge and real estate agency services.  Please be aware that all correspondence with representatives of our company is conducted via “playrix.com” exclusively and no other entities."
