URL,Location,Company,Employment Type,Years of Exp,Education Level,Data
"https://www.glassdoor.com/job-listing/software-engineer-ai-signal-research-inc-asri-JV_IC1127653_KO0,17_KE18,45.htm?jl=1009055500340",Alabama,"AI Signal Research, Inc (ASRI)",,not given,,"Thank you for your interest in AI Signal Research, Inc. (ASRI). ASRI accepts applications for employment for current career opportunities only.  Education:: ABET accredited BS in an Engineering discipline, or BS in Computer Science or related technical field.  Months/Years of Experience: :Minimum two (2) years of related experience.   Required Qualifications: :U.S. Citizen. Ability to obtain and maintain a security clearance. Knowledge of the complete Software/Systems Development process and lifecycle. Knowledge of requirements management tools (e.g. DOORS). Familiarity with aviation systems. Some travel.  Skills Needed:: Strong background in C/C++, background in Java.  Duties::  Desired Qualifications: :Aviation, IV&V and modeling & Simulation experience is a plus.  Comments: :Compliance with health mandates as dictated by the contract may be required as condition of employment. ASRI offers the following Benefits package: 401K Plan Medical and Dental Insurance Life Insurance Disability Income Educational Assistance Direct Deposit Cafeteria Plan Vision   Drug Free Workplace.: Adherence to ASRI policy on drugs and alcohol is a condition of employment for all employees.  AI Signal Research, Inc. (ASRI) wants all interested and qualified candidates to apply for employment opportunities. If you are an applicant with a disability who is unable to use our online tools to search and apply for jobs, please contact us by calling (in the U.S.) 1-256-551-0008 x29. Please indicate the specifics of the assistance needed. This option is reserved only for individuals with disabilities who are unable to use our online tools and is not intended for any other purpose:.  ASRI is an equal opportunity and affirmative action employer-Veterans/Disabled and other protected categories."
"https://www.glassdoor.com/job-listing/software-engineer-gan-JV_IC1127653_KO0,17_KE18,21.htm?jl=1008725545645",Alabama,GaN,,5,,"Overview:  Wanted - Big Brains & Huge Hearts: We are looking for creative and passionate geeks, nerds, thinkers, tinkerers, and builders. Geeks and Nerds is a company that encourages ingenuity, defies the norm, fosters teamwork, and defines the future for the community where we live. Our dedicated employees are also the owners of Geeks and Nerds. When you join GaN you are not just an employee, you are the future owner of Geeks and Nerds. Come join the company and develop innovative solutions to make a positive difference for our community. Come join the exceptionally talented and dedicated co-owners. Come join a company of significance! Do you enjoy developing solutions to support Open Architecture Software? We are looking for exceptional candidates for a Software Engineering role. Apply today and become an owner where big hearts and big brains meet. Job Overview: GaN is seeking an experienced Software Engineer to join our team in Huntsville, Alabama. Responsibilities:  Clearance: SECRET IS REQUIRED Required: SECRET security clearance. S. in a technical field such as Computer Engineering, Electrical Engineering, Computer Science. Minimum 5+ years relevant experience. Experience supporting a Government Project or Product Office in an acquisition organization such as PEO AVN or PEO M&S. Accomplished self-starter with the ability to work in a small team with minimal supervision. Experience collaborating with project or product office personnel. Experience with open standards such as FACE Technical Standard, HOST Standard, SOSA Technical Standard, VICTORY, OMS, etc. Provide key software technical expertise for documentation review, analysis of Program or Contractor metrics, schedule, and cost estimates. Identify and track software risk areas for the program and implement risk mitigation plans. Assist PMs, or other customers, to generate metrics and measurement techniques to provide program office leadership with timely and accurate information on the state of ongoing and planned efforts. Assist PMs in development of cybersecurity documentation and coordination of cybersecurity test events. Develop/Review system/subsystem specifications, system architectures, program briefings, white papers, and other products. Experience developing contract language and requirements, reviewing, and evaluating contractor deliverables. Desired Program Management or Project Management experience. Prefer Experience with Army Aviation platforms such as Apache, Blackhawk, Chinook, UAS, FLRAA or FARA. Knowledge of at least one Object-Oriented Programming (OOP) language. Prefer Experience using common Model-Based Systems Engineering tools (e.g., Cameo, Rhapsody, etc.). Experience using issue-tracking software such as Jira or Git Experience. Qualifications:  Geeks and Nerds is an innovative technology company that encourages ingenuity, defies the norm, fosters teamwork, and defines the future for our community and nation. We are an Employee-Owned company which means our dedicated team members are also the owners of Geeks and Nerds. When you join GaN, you are not an employee; you are the future owner of Geeks and Nerds. Come join the company that develops innovative solutions that makes a positive difference in our community and nation. Come join the exceptionally talented and dedicated co-owners. Join a company of significance!  GaN Corporation is an Equal Opportunity Employer. We are pleased to consider all qualified applicants for employment without regard to race, color, gender, sexual orientation, gender identity, religion, national origin, age, marital status, veteran status, disability, genetic information or any other legally protected classifications. GaN Corporation participates in E-Verify."
"https://www.glassdoor.com/job-listing/software-engineer-ii-bae-systems-JV_IC1127653_KO0,20_KE21,32.htm?jl=1009086385040",Alabama,BAE Systems,"Fulltime, Flexible, Hybrid, Remote",2,BA,"Job Description  Because this role involves a combination of collaborative/in-person and independent work, it will take the form of a hybrid work format, with the majority of your time working onsite along with some remote activities when possible. Do you want to be part of a team that designs and writes software that really matters? Do you want to contribute to bringing America’s warfighters home safely? Do you want to be a part of a cause greater than yourself? Then, we need to talk!  Our engineers are the lifeblood of our company, and we are more than 5,000 strong. With our robust offering of educational and career development opportunities, your chances to grow are limitless.   In Precision Strike & Sensing Solutions (PS) we design, develop, and manufacture state-of-the-art systems and technology that enable our customers to execute their mission. We are thought leaders in the application of seeker, guidance, and control technologies, and we have a place waiting for you at our Huntsville, Alabama facility. Job Overview and Opportunities We are looking for a talented early career Software professional to help us create the world’s most advanced solutions in the area of precision guided munitions and missiles. We develop and incorporate algorithms utilizing a multi-processor architecture that also incorporates GPUs. Our software implementations transform both radar and infrared gathered signals to enable weapons to precisely find their target and keep our warfighters safe as they execute their missions.   In this exciting role, you will enjoy opportunities to take on diverse and challenging work assignments, flexible scheduling with every other Friday off, an inviting and supportive culture, competitive compensation, and an excellent benefits package that includes tuition reimbursement for advanced degrees. We will provide you opportunities to learn, leverage our current technologies, incorporate new technologies, and if you desire…become an expert or future technical leader in our engineering organization. Job Environment In your role, you will be part of a dynamic software development team performing analysis, design, implementation, and integration of typically C++ based embedded software in a Linux development environment utilizing a DevSecOps Software Factory approach.  If you desire more, you can grow into a technical leader in our engineering organization where you can mentor and lead a development team along with having opportunities to present your craft and technical designs to our customers. We put our customers first – exemplified by our mission: “We Protect Those Who Protect Us®.”  Please note that pursuant to a government contract, this specific position requires US citizenship status.  Required Education, Experience, & Skills  Secret Clearance (active within the last two years) Bachelor's Degree in computer science, computer engineering, or related field, and 2 years related work or equivalent experience Experience with modern design, development practices, and implementation in C++ Experience with source code control and collaboration tools Willingness to perform a wide variety of related tasks over the software lifecycle  Preferred Education, Experience, & Skills  Real-time embedded development GIT, Jira, Confluence Agile Development experience within a DevSecOps environment Designing and/or implementing software algorithms  Pay Information Full-Time Salary Range: $68700 - $116800  Please note: This range is based on our market pay structures. However, individual salaries are determined by a variety of factors including, but not limited to: business considerations, local market conditions, and internal equity, as well as candidate qualifications, such as skills, education, and experience.   Employee Benefits: At BAE Systems, we support our employees in all aspects of their life, including their health and financial well-being. Regular employees scheduled to work 20+ hours per week are offered: health, dental, and vision insurance; health savings accounts; a 401(k) savings plan; disability coverage; and life and accident insurance. We also have an employee assistance program, a legal plan, and other perks including discounts on things like home, auto, and pet insurance. Our leave programs include paid time off, paid holidays, as well as other types of leave, including paid parental, military, bereavement, and any applicable federal and state sick leave. Employees may participate in the company recognition program to receive monetary or non-monetary recognition awards. Other incentives may be available based on position level and/or job specifics.  About BAE Systems Electronic Systems  BAE Systems, Inc. is the U.S. subsidiary of BAE Systems plc, an international defense, aerospace and security company which delivers a full range of products and services for air, land and naval forces, as well as advanced electronics, security, information technology solutions and customer support services. Improving the future and protecting lives is an ambitious mission, but it’s what we do at BAE Systems. Working here means using your passion and ingenuity where it counts – defending national security with breakthrough technology, superior products, and intelligence solutions. As you develop the latest technology and defend national security, you will continually hone your skills on a team—making a big impact on a global scale. At BAE Systems, you’ll find a rewarding career that truly makes a difference. Electronic Systems (ES) is the global innovator behind BAE Systems’ game-changing defense and commercial electronics. Exploiting every electron, we push the limits of what is possible, giving our customers the edge and our employees opportunities to change the world. Our products and capabilities can be found everywhere – from the depths of the ocean to the far reaches of space. At our core are more than 14,000 highly talented Electronic Systems employees with the brightest minds in the industry, we make an impact – for our customers and the communities we serve.  Our Commitment to Diversity, Equity, and Inclusion: At BAE Systems, we work hard every day to nurture an inclusive culture where employees are valued and feel like they belong. We are conscious of the need for all employees to see themselves reflected at every level of the company and know that in order to unlock the full potential of our workforce, everyone must feel confident being their best, most sincere self and be equipped to thrive. We provide impactful professional development experiences to our employees and invest in social impact partnerships to uplift communities and drive purposeful change. Here you will find significant opportunities to do meaningful work in an environment intentionally designed to be one where you will learn, grow and belong."
"https://www.glassdoor.com/job-listing/software-engineer-ierus-technologies-inc-JV_IC1127653_KO0,17_KE18,40.htm?jl=1009073280859",Alabama,"IERUS Technologies, Inc.",,not given,,"IERUS specializes in electromagnetic spectrum technologies and design for RF, IR, and optical applications. IERUS also supports customers with a diverse set of competencies including software development, air and missile defense, and systems engineering. IERUS develops value for our defense and commercial customers through accelerations of the technology life cycle: identifying, creating, transitioning, and producing technologies with integrity of purpose and product. IERUS is looking for bright, talented, motivated, and dedicated employees in the engineering field, and offers competitive compensation and benefits package. To learn more, please visit www.ierustech.com Job Description The primary responsibilities of this position software engineering and development including design and analysis of Ground Support Equipment and Launch Control Systems software. This position is also responsible for various embedded firmware and software applications including designing, testing and implementation of such software’s. Required Qualifications  Bachelor of Science in Electrical Engineering, Computer Engineering, Computer Science or related field. Three plus years of experience in software engineering and development including design & analysis. Experience in various software languages including C, C++, python, ADA, etc. Active DoD Secret clearance Must be a US citizen  Location: Huntsville, AL IERUS Technologies is an Equal Opportunity/Affirmative Action Employer. All qualified applicants will receive consideration for employment without regard to race, color, religion, sex, sexual orientation, gender identity, national origin, disability or veteran status, age, or any other federally protected class. IERUS Technologies participates in E-Verify."
"https://www.glassdoor.com/job-listing/senior-software-engineer-c-integration-innovation-inc-JV_IC1127653_KO0,26_KE27,53.htm?jl=1009097751790",Alabama,"Integration Innovation, Inc.",,10,,"Overview:  i3 is seeking a Software Engineer to develop cutting edge training and simulation for the US Army MQ-1C Gray Eagle Uncrewed Aerial System (UAS)'s next generation simulation and trainer. This project uses modern .NET/C# libraries including Blazor and SignalR. This project provides a unique opportunity to develop a new product from the ground up and enhance your front-end and back-end skillsets. Responsibilities: Candidate will develop software designs using best practices and object-oriented methodologies. Software will be developed using an agile-scrum development style. Integrating third-party libraries and applications into the overall system. Routine collaboration with team members in developing system capabilities. The candidate will be familiar with good configuration management practices and will be responsible for proper code maintenance, merging, and configuration management. Position Location: Huntsville, AL CONUS Travel required: Less than 10% Qualifications: Required Experience Have a Bachelor’s degree (or advanced degree) from an accredited college (ABET preferred) in computer science, engineering, mathematics, or the hard sciences, with 10+ years of professional experience. Additional years of experience may be substituted for degree. Have experience developing software in C#. Experience (academic or professional) in at least one other programming language, such as C, C++, Java, or Python. Have experience with an agile development methodology and associated tools. Have experience with a configuration management software tool. Basic design patterns like the repository, factory, and decorator patterns. Communicating with third-party applications using low level messages via UDP/TCP or higher-level protocols such as gRPC. Security Clearance: Candidate must have the ability to obtain a SECRET security clearance. Preferred Experience Familiarity with git for software source control and configuration management. Experience with virtualization technologies like Docker, Podman, and VmWare's suite. Familiarity with UAS Command and Control Protocols like STANAG-4586 and FACE. Experience developing 6-DOF Aircraft simulation models is a plus. Experience with Image and Scene Generator tools like CIGI, VRSG, and BlueIG. Experience with C# Unit Testing frameworks like NUnit, XUnit, Specflow. Experience leading a team of software developers to develop a product or capability. About i3:  Headquartered in Huntsville, AL, i3 is a national leader in providing innovative technical and engineering solutions to a broad customer base across the U.S. DoD. Specializing in missile and aviation engineering and logistic services, electronic warfare and electromagnetic affects analysis, UAS system integration and flight operations, full lifecycle C5ISR engineering services, engineering analysis, cybersecurity and IT/IA innovative solutions and virtual training, simulation & serious game development and implementation. We were founded in 2007 with the intent to do business differently. Our focus is to leave our team members, our customers and our communities better than we found them. Our ultimate goal is to strengthen our Nation and our warfighter. Perks and Benefits at i3: 100% team member owned Outstanding insurance coverage 401(k) match Health and wellness incentives Tuition and certification reimbursement Generous PTO Fun culture with company activities Countless opportunities to give back to the community through our charitable organization, i3 Cares We work hard. We compete hard. We play hard. Apply now to join us!"
"https://www.glassdoor.com/job-listing/tier-1-end-user-support-engineer-remote-hybrid-birmingham-al-area-magna5-ms-llc-JV_IC1127429_KO0,65_KE66,79.htm?jl=1009060607921",Alabama,Magna,Flexible,not given,,"Description:  ***Candidates must be within the Birmingham area. This role is 50% work from home and 50% work from customer sites in the Birmingham area. About the Role As a member of the Service Delivery team, an End User Support Engineer (Tier 1) is responsible for customer issues such as solving usage problems and fulfilling service desk requests that need IT involvement. The ability to work independently and remain self-motivated is a must. A strong work ethic and a proven track record of attendance is essential. The expectation is that the technician will troubleshoot beyond the PC, including troubleshooting servers, network devices, and cloud systems. The End User Support Engineer (Help Desk Technician) will work closely with the other staff members under the manager’s direction with responsibilities including, but not limited to: Responding to customer support requests that come in via phone, email, chat, or customer portal Interface with clients onsite 20 hours a week M-F, 8-12 Interacting with clients using professionalism and promptness Jointly solving problems through collaboration with team members. Providing quality customer service skills in all forms of communication Collaborating with Tier 2 and Tier 3 technicians on escalated customer support requests Documenting resolutions and building knowledge base articles Tracking time and activity in the Magna5 ticketing system Utilizing the Magna5 monitoring and cybersecurity systems to triage alerts and alarms Requirements:  What You Bring to the Team While an associate's degree is preferred, we value relevant and significant industry experience as a substitute for the education requirement. Microsoft, Cisco, and VMware certifications are required. Minimum of 12 months experience in administering/supporting any of the following: LAN/WAN environments Office365 and Azure Network Operations Center Help desk or relevant customer service skills Experience with PSA and RMM Tools Certifications Expectations: Microsoft, Cisco, Fortinet, and VMware certifications required. Cisco Certified Network Associate (CCNA) Microsoft Intermediate Certificates Security+ Fortinet Network Security Expert 7 (NSE7) Preferred Skills: Microsoft Windows Server 2012/2016/2019 and Active Directory Microsoft Office Suite and Office365 experience Fundamental understanding of DNS, DHCP, and TCP/IP Microsoft Exchange and SQL Server VMware vSphere 6.5 and above Knowledge of backup technologies Knowledge of security practices and policies Work Perks 50% WFH / 50% onsite at clients Paid time off including paid holidays and floating holidays. Bonus potential based on individual and company performance. Highly competitive and flexible medical, dental, and vision benefits plans 401(k) with employer match Tailored Life and Disability insurance plans Full reimbursement for approved professional certification and career enriching opportunities. Magna5 Values Win Together – We collaborate with clients and across the Magna5 team to provide complete solutions for every IT challenge. Respond Fast – When clients or teammates reach out, we answer with urgency, assembling the needed expertise to provide quick and accurate resolutions. Earn Trust – We strive to earn and keep the trust of our clients and teammates through our actions every day, fulfilling every promise we make. Stay Transparent – No secrets and no surprises. We respect our clients and one another by providing candid assessments and complete, accessible information. Think Ahead – “Good enough” isn’t good enough. We strive to be the best. Our team members are proactive with our problem solving and work to stay on the leading edge of new technologies that drive client success. What We Do Magna5 is a rapidly growing IT Managed Service Provider delivering cybersecurity, private and public cloud hosting, backup and disaster recovery and other advanced services from mid-market to enterprise customers nationwide, including leaders within the education, healthcare, government, financial services, manufacturing, and other industry segments. We integrate advancements in technology and processes to drive businesses forward. As a trusted managed services provider, we bring together the right mix of managed IT services, security, and network connectivity, fully managed by our team of experts 24/7/365. Our passion is to help companies function better, faster, and smarter. We offer an exciting and collaborative environment, with growth potential. For more information, visit our website at www.magna5.com."
