URL,Location,Company,Employment Type,Years of Exp,Education Level,Data
"https://www.glassdoor.com/job-listing/part-time-assistant-programmer-mobile-county-public-schools-JV_IC1127676_KO0,30_KE31,59.htm?jl=1009104169910",Alabama,Mobile County Public Schools,Parttime,3,,"***This is a Part-Time position. Individuals employed in this position will work 19.5 hours per week or less.***  The duties include but are not limited to: Assists in the development of new information technology solutions and modifying existing information technology solutions including data structures, language requirements, and user interfaces. Analyzes client datasets utilizing knowledge of SQL and MS Access. Evaluates the integrity of the data and converts databases into a format suitable for data mining. Consults with actuaries in evaluating the implications of the results. Assists in Research and Development efforts by assisting in the development and programming. Assists in the interface with clients to gather requirements and data. Assists the Programmers with establishing file requirements. Tests the operation of complete programs and prepare the logical interface between related programs. Assists in the development of Web Application. Assists in the design of automated portions of systems Administers, monitors, and/or modifies automated information system software and applications. Analyzes program specifications for completeness and conformance to standards. Assists others with program coding and test as needed. Performs any job-related task that is assigned by the Executive Manager of Technology that contributes to the effective operation of the Technology Division.   QUALIFICATIONS: Must be a college graduate from a regionally accredited four-year college or university in computer science.  Must be able to participate in multiple engagements and to interface often with senior management utilizing strong communication and analytical skills to deliver creative solutions.  Must have 3 years or more of experience performing data analysis.  Must have working knowledge of predictive modeling, relational databases, and computational data analysis.  Must have solid computer skills.  Must have working knowledge of SQL and MS Access.  Duty Days 260  Salary Range: From/To Beginning pay - $15.00/hour, not to exceed 19.5 hours per week.  Additional Job Information **Applicants selected for classified positions must undergo (or have undergone) an ABI/FBI criminal history background check (fingerprinting administered through sites selected and approved by the MCPSS and State of Alabama Education Department) and be declared suitable and fit to teach under state law. Applicants selected must also pass a drug-screening test via forms provided by Human Resources during the selection process.**   THE MOBILE COUNTY PUBLIC SCHOOL SYSTEM IS AN EQUAL OPPORTUNITY EMPLOYER.   Job Attachment  The State does not discriminate on the basis of age, race, color, sex, sexual orientation, religious preference, marital status, disability, national origin, or any other reason prohibited by state or federal law. Employees of the District are required to comply with the provisions of Title VII of the Civil Rights Act and Title IX of the 1972 Educational Amendments.  Alabama school boards are required by state law to verify the employment eligibility of newly hired employees by using the federal E-Verify program. New employees are required to provide a Social Security number, an unexpired identity document that contains a photograph, and other acceptable documents that establish employment eligibility. In addition to determining whether a new hire is authorized to work in the United States, E-Verify will confirm that the employee's name and Social Security number match. Use of any published data or content on this web site is prohibited without the written consent of the Alabama State Department of Education."
"https://www.glassdoor.com/job-listing/software-engineering-talent-community-l3harris-technologies-JV_IC1127653_KO0,37_KE38,59.htm?jl=1009037349683",Alabama,Element with the specified ID not found.,,not given,,Element with the specified ID not found.
"https://www.glassdoor.com/job-listing/software-engineer-ii-fis-global-JV_IC1127429_KO0,20_KE21,31.htm?jl=1009107656672",Alabama,FIS Global,Fulltime,not given,,"Position Type : Full time Type Of Hire : Experienced (relevant combo of work and education) Education Desired : Bachelor of Computer Engineering Travel Percentage : 0% Job Description About FIS Are you curious, motivated, and forward-thinking? At FIS you’ll have the opportunity to work on some of the most challenging and relevant issues in financial services and technology. Our talented people empower us, and we believe in being part of a team that is open, collaborative, entrepreneurial, passionate and above all fun. About the team You will be joining a small team of developers working in an Agile environment on a web-based product we license to our financial customers. We use scrum methodologies to rapidly deliver the features our customers demand so that they can be competitive in their markets. What you will be doing You will be a full stack developer working on a front-end web application that communicates to back-end APIs. You will be interacting with your team members and product management to deliver the features our customers require. Some of the tasks you will be doing include:Web based UI design.Creating and modifying APIs.Writing SQL queries.Creating and executing test cases. What you bringKnowledge of web-based design using JavaScript frameworks such as Angular.Familiarity with how relational databases work and best practices for developing/modifying database objects such as tables, indexes, and queries.Strong communication skills and the ability to implement ideas clearly and correctly.Ability to work with minimal supervision. Bonus if you have o Angular o Oracle Databases o TypeScript/JavaScript o C#, C++ o Microsoft Visual Studio o GIT Source Control What we offer youA competitive salary.A fantastic range of benefits designed to help support your lifestyle and wellbeing.Varied and challenging work to help you grow your technical skillset.  FIS is committed to providing its employees with an exciting career opportunity and competitive compensation. The pay range for this full-time position is $83,060.00 - $139,530.00 and reflects the minimum and maximum target for new hire salaries for this position based on the posted role, level, and location. Within the range, actual individual starting pay is determined additional factors, including job-related skills, experience, and relevant education or training. Any changes in work location will also impact actual individual starting pay. Please consult with your recruiter about the specific salary range for your preferred location during the hiring process. Privacy Statement FIS is committed to protecting the privacy and security of all personal information that we process in order to provide services to our clients. For specific information on how FIS protects personal information online, please see the Online Privacy Notice. EEOC Statement FIS is an equal opportunity employer. We evaluate qualified applicants without regard to race, color, religion, sex, sexual orientation, gender identity, marital status, genetic information, national origin, disability, veteran status, and other protected characteristics. The EEO is the Law poster is available here supplement document available here For positions located in the US, the following conditions apply. If you are made a conditional offer of employment, you will be required to undergo a drug test. ADA Disclaimer: In developing this job description care was taken to include all competencies needed to successfully perform in this position. However, for Americans with Disabilities Act (ADA) purposes, the essential functions of the job may or may not have been described for purposes of ADA reasonable accommodation. All reasonable accommodation requests will be reviewed and evaluated on a case-by-case basis. Sourcing Model Recruitment at FIS works primarily on a direct sourcing model; a relatively small portion of our hiring is through recruitment agencies. FIS does not accept resumes from recruitment agencies which are not on the preferred supplier list and is not responsible for any related fees for resumes submitted to job postings, our employees, or any other part of our company. #pridepass"
"https://www.glassdoor.com/job-listing/automation-machine-vision-engineer-management-recruiters-of-tallahassee-JV_IC1127412_KO0,34_KE35,71.htm?jl=1009086642636",Alabama,Management Recruiters of Tallahassee,,4,,"Our client, a specialized plastic manufacturer, is growing exponentially and is seeking an Automation/Machine Vision Engineer to support their programs, software, and hardware that performs inspections of their parts. With an extremely competitive compensation structure, this opportunity will not last long on the market.  For this role, you can reasonably expect to perform the following:   Program and System Management: Developing, managing, and modifying software programs for product inspection, and maintaining the vision system hardware. Troubleshooting and Maintenance: Regularly troubleshooting technical issues and performing maintenance, including hardware upgrades and replacements. Data Analysis and Process Improvement: Collecting and analyzing data to enhance the accuracy and efficiency of the inspection processes. Team Collaboration and Cross-Training: Collaborating with engineering peers, learning their roles for support, and sharing knowledge. Specialization and Adaptability: Focusing on vision systems with flexibility in the role title and openness to continuous learning, especially for fresh graduates.  Qualifications/Education/Special Skills   Minimum degree level of BS in Engineering. Minimum of 4 years of experience in machine vision and data collection systems. Minimum of 2 years of management experience. Advanced computer skills including Microsoft Office.  "
"https://www.glassdoor.com/job-listing/developer-sap-JV_IC1127429_KO0,9_KE10,13.htm?jl=1009063931457",Alabama,SAP,"Fulltime, Permanent",5,"Master, Bachelor's degree","Requisition ID: 383822 Work Area: Software-Design and Development Expected Travel: 0% Career Status: Professional Employment Type: Regular Full Time Career Level: T2 Additional Locations:  ORIGINAL POSTING DATE: November 10, 2023 Location: Newtown Square, PA Purpose and Objective: Callidus Software, Inc. seeks a Developer at our Newtown Square, PA location responsible for development focusing on design, coding, testing, and quality assurance of specific product features in a development team. Expectations and Tasks: Analyze and solve issues in existing and new code. Responsible for the design, implementation, and maintenance of modules or product features. Provide application implementation services typically within the boundaries of specifications and project plans. Design activities include requirements analysis and design documentation. Implementation activities include implementation, testing, and integration. Maintenance activities include error analysis and removal. Extend, modify, or adapt existing designs. May also be involved in the development of new (sub-)systems. Demonstrate full responsibility for accepted tasks and demonstrate a high level of quality, speed, reliability and efficiency. Work together with others and share expertise to ensure product success. Enhance skills beyond own core functional focus and works on other tasks for the benefit of the team. Utilize advanced product knowledge and share expertise within the team. Education and Qualifications/Skills and Competencies: Bachelor's degree or foreign equivalent in Computer Science, Engineering, Mathematics or a related field and 5 years of experience in the job offered or a related occupation. The Company will also accept a Master’s degree or foreign equivalent in Computer Science, Engineering, Mathematics or a related field and 2 years of experience in the job offered or a related occupation. Work Experience: Experience must involve 1 year in the following: Programming using Java, Java Database Connectivity (JDBC), and SQL;Web technologies including HTML, CSS, JavaScript, and jQuery;REST API Programming;Test Driven Development using JUNIT;Software methodologies including Agile Development;Software builds and operations using Tomcat, Jenkins, and Kubernetes; andApplication development using software design patterns. Travel: N/A. Telecommuting permitted. This position is eligible for the Employee Referral Program subject to the eligibility criteria outlined in the SAP Internal Employee Referral Policy. Internal use only: reference code lhrs4262 SAP:SAIL Compensation Range Transparency: The annual base salary for this position is $140,046. SAP believes the value of pay transparency contributes towards an honest and supportive culture and is a signiﬁcant step toward demonstrating SAP’s commitment to pay equity. SAP provides the annualized compensation range inclusive of base salary and variable incentive target for the career level applicable to the posted role. The targeted combined range for this position is $140,046 to $156,700. The actual amount to be oﬀered to the successful candidate will be within that range, dependent upon the key aspects of each case which may include education, skills, experience, scope of the role, location, etc. as determined through the selection process. Any SAP variable incentive includes a targeted dollar amount and any actual payout amount is dependent on company and personal performance. Please reference this link for a summary of SAP beneﬁts and eligibility requirements: SAP North America Benefits. SAP'S DIVERSITY COMMITMENT  To harness the power of innovation, SAP invests in the development of its diverse employees. We aspire to leverage the qualities and appreciate the unique competencies that each person brings to the company. SAP is committed to the principles of Equal Employment Opportunity and to providing reasonable accommodations to applicants with physical and/or mental disabilities. If you are in need of accommodation or special assistance to navigate our website or to complete your application, please send an e-mail with your request to Recruiting Operations Team: Careers@sap.com Successful candidates might be required to undergo a background verification with an external vendor. For SAP employees: Only permanent roles are eligible for the SAP Employee Referral Program, according to the eligibility rules set in the SAP Referral Policy"
"https://www.glassdoor.com/job-listing/software-engineer-lynker-corporation-JV_IC1127776_KO0,17_KE18,36.htm?jl=1009061002406",Alabama,Lynker Corporation,Flexible,2,BA,"Lynker is supporting the National Oceanic and Atmospheric Administration (NOAA) in providing comprehensive river and flood forecasts and warnings, for use by the public and emergency managers to protect life and property. This critical water intelligence also supports socio-economic decision-making for a sustained and enhanced economy. We are seeking an experienced Software Engineer / Java Developer to work on the team that provides integrated water prediction, forecasting the movement and presence of water throughout the nation in terms of quantity and availability, from the summit to sea, treetop to bedrock, with the appropriate timeliness, resolution, reliability, accuracy, and quantified uncertainty required to inform risk-based water resource management decisions. The ideal candidate will have extensive experience in developing high-performance, scalable and reliable applications using Java technologies. The Java Developer will work closely with the development team to design, develop, test and maintain software applications. The role will require excellent problem-solving skills, attention to detail, and the ability to work collaboratively in a team environment.   Duties of the Software Engineer / Java Developer will include the Following: Design, develop and maintain software applications using Java, C# and Python. Designs and codes software components, units, and modules that meet product specifications and development schedules. Tests and debugs assigned components and units, Participated in large system and subsystem planning. Write clean, maintainable and efficient code that meets software standards and guidelines. Participate in code reviews and provide constructive feedback to improve code quality. Mentor and train junior team members Assist in ""Research to Operations "" efforts, deploying the latest science in water prediction into a reliable operational environment. Assist computational scientists in bridging the gap between applied research and software engineering; supporting mathematical modeling, numerical analysis, algorithm development, analysis, validation, and visualization of results.  The Software Engineer / Java Developer selected should have the Following: Skilled at utilizing: GitHub, Docker, and Automation scripts Beneficial if skilled at utilizing: AWS environments, Community Development Languages: Java, Python. Experience with C#, and .NET is a plus Strong knowledge of Core Java, Spring Framework, Hibernate and Web Services (SOAP and REST) Experience with JavaScript, HTML and CSS is a plus Excellent problem-solving skills and attention to detail 2+ years of Unit testing and capable of developing test units Strong experience developing in a Linux/Unix environment Experience with Agile development methodologies is preferred  The Ideal Software Engineer / Java Developer will have the Following: 3 to 5 years of software engineering experience BS/BA in computer science or similar Analyzing development requirements Conduct application design Create and present design documents for review About Lynker Lynker is a growing, employee owned, small business, specializing in professional, scientific and technical services. Our continually expanding team combines scientific expertise with mature, results-driven processes and tools to achieve technically sound, cost effective solutions in hydrology/water sciences, geospatial analysis, information technology, resource management, conservation, and management and business process improvement. We focus on putting the right people in the right place to be effective. And having the right people is critical for success. Our streamlined organization enables and empowers our talented professionals to tackle our customers' scientific and technical priorities creatively and effectively. Lynker offers a team-oriented work environment, and the opportunity to work in a culture of exceptionally skilled and diverse professionals who embrace sound science and creative solutions. Lynker's benefits include the following: Comprehensive healthcare for the employee at no monthly cost Healthcare benefit covers medical, prescription drug, dental, and vision Personal Time Off (PTO) Policy plus paid holidays Highly competitive compensation plan regularly calibrated against industry and location benchmarks 401(k) retirement plan with company-matching Employee Stock Ownership Plan (ESOP) we're all company owners! Flexible spending accounts Employee assistance program (EAP) Short- and long-term disability insurance Life and accident insurance Tuition assistance/Training/Workforce improvement reimbursement per year Spot bonuses for exceptional performance Annual Employee Recognition Awards with bonuses Employee Referral Program Free centralized, self-directed Learning Management System to learn at your own pace Personalized career growth plans for every employee Lynker is an E-Verify employer. Lynker is proud to be an Equal Opportunity Employer and encourages women, minorities, individuals with disabilities and veterans to apply."
"https://www.glassdoor.com/job-listing/database-developer-lockheed-martin-JV_IC1127653_KO0,18_KE19,34.htm?jl=1009097333467",Alabama,Lockheed Martin,Fulltime,0,,"Database developer to support front end systems (as needed by developers across the organization, in support of web services, third party, or internal development needs) to the exclusion of reporting needs by other departments. Developed code includes but is not limited to PL/SQL in the form of Triggers, Procedures, Functions, & Materialized Views. Generates custom driven applications for intra-department use for business users in a rapid application development platform (primarily APEX). Responsible for functional testing and deployment of code through the development life cycle. Works with end-users to obtain business requirements. Responsible for developing, testing, improving, and maintaining new and existing processes to help users retrieve data effectively. Collaborates with administrators and business users to provide technical support and identify new requirements.  Responsibilities  Responsibilities: Design stable, reliable and effective database processes. Solve database usage issues and malfunctions. Gather user requirements and identify new features. Provide data management support to users. Ensure all database programs meet company and performance requirements. Research and suggest new database products, services, and protocols. Requirements and skills In-depth understanding of data management (e.g. permissions, security, and monitoring) Excellent analytical and organization skills An ability to understand front-end user requirements and a problem-solving attitude Excellent verbal and written communication skills Assumes responsibility for related duties as required or assigned. Stays informed regarding current computer technologies and relational database management systems with related business trends and developments. Consults with respective IT management in analyzing business functions and management needs and seeks new and more effective solutions. Seeks out new systems and software that reduces processing time and/or provides better information availability and decision-making capability. Job Type: Full-time Pay: From $115,000-128,000 yearly Expected hours: 40 per week Benefits: Dental insurance Health insurance Paid time off Vision insurance Paid time off (PTO) Various health insurance options & wellness plans Required Knowledge  Considerable knowledge of on-line and design of computer applications. Require Experience  One to three years of database development/administration experience. Skills/Abilities  Strong creative and analytical thinking skills. Well organized with strong project management skills. Good interpersonal and supervisory abilities. Ability to train and provide aid others."
