URL,Location,Company,Employment Type,Years of Exp,Education Level,Data
"https://www.glassdoor.com/job-listing/associate-controls-software-engineer-pa-solutions-JV_IC1127428_KO0,36_KE37,49.htm?jl=1009082923664",Alabama,PA Solutions,Flexible,not given,,"Job Description Required Duties: The candidate must be able to work in a professional engineering team-based environment. Engineering teams are responsible for the design and integration of control systems for customer applications and processes. Duties may include and are not limited to PLC and HMI programming, network design, system commissioning, system support, internal/external training, and technical consultation. Areas of focus are controls standardization. Candidate Responsibilities / Must also possess the following traits: Logical thinker & problem solver Organized & detail oriented Strong verbal and written communication skills Self-motivated with “can do” mindset Strong leadership skills Team player with emphasis on team development Innovative regarding new processes and development aids Budget and deadline aware Must be willing to travel up to 70% Must be willing to work long hours on various shift models Specific Responsibilities: The following lists are general responsibilities that may vary from customer to customer. Developing standardize code & development tools, including: Creating PLC/HMI/Diagnostic Libraries (AOIs, FBs, UDT, Faceplates, etc.) Creating Quality Check Tools – used to validate standards were properly executed Creating Process for Standards deployment including input/outputs of deliverables and utilizing check-in/check-out and sign-off procedures to ensure Quality and Timing Milestones are met Secondary: Participate in Design Reviews and support customer meetings proactively Train team members on project standards as applicable Plan to execute work within budget, with exceptional quality (FTR), and on time Track and report metrics as required Forecast time/resources to complete remaining work Participate in continuous improvement initiatives and champion outcomes of the initiatives. Supervise activities of functionally assigned personnel, applying knowledge of automation concepts and procedures and production area knowledge Execute, supervise, and verify all works aligns to customer specifications and expectations. Apply special knowledge of automation, controls engineering, and robotics where applicable Travel to customer sites as necessary for the betterment of assigned team or to personally deliver optimal solutions Additional Information Technical Skills: PLC Programming Rockwell – Studio5000, RSLogix 5 Siemens – TIA Portal V15+, Step 7 HMI Design: Rockwell – RS/FT View ME/SE Siemens – TIA Portal Advanced, WinCC Flexible/SCADA Computer Programming: Experience in one or more of the following: Visual Basic, C++, C#, Java, Python, etc. General Networking - Ethernet troubleshooting and design of various hardware types and configurations Network Address Translation VLANs Various Network Topologies (Star, Linear, Ring…) Business Software - Produce documentation, calculations, and presentations Microsoft Office: Hardware Design: Understand electrical, pneumatic and water schematics and complete the integration of industrial automation systems Education and Experience: Bachelor’s degree in a controls related field (Electrical Engineering, Computer Engineering, Computer Science or equivalent) One to three plus years of applicable experience in an industrial environment that includes design, debug, startup, and production-readying of industrial controls equipment. Must have knowledge of multiple customer platforms. Experience must include complete knowledge of full project lifecycle HSE All employees have the responsibility to work in a safe manner and report any health, safety or environmental concern to their manager or supervisor in a timely manner. Employee responsibilities for Health, Safety and Environment include: Work in compliance with divisional health, safety and environmental procedures Refrain from removing or altering safety devices or guarding unless hazardous energies are controlled through lockout-tagout methods Report any unsafe conditions or unsafe acts Report defect in any equipment or protective device Ensure that the required protective equipment is used for the assigned tasks Attend all required health, safety and environmental training Report any accidents/incidents to supervisor Assist in investigating accidents/incidents Refrain from engaging in any prank, contest, feat of strength, unnecessary running or rough and boisterous conduct Join the Winning Team at PA Solutions, Inc. (a global division of ATS Automation). We help exceptional customers automate their manufacturing as Tooling System Integrators. We work with Global OEM's/Tier suppliers supporting transportation and aerospace industries. Take your place among the best in the business and grow your career with PA Solutions, Inc. Join an environment where a passion for innovation is combined with an uncompromised commitment to quality. PA Solutions, Inc. offers a superior benefits package designed with you in mind! If you would like to automate your future, check us out and be a part of our unprecedented growth! All qualified applicants will receive consideration for employment without regard to race, color, religion or belief, national, social or ethnic origin, sex (including pregnancy), age, physical, mental or sensory disability, HIV status, sexual orientation, gender identity and/or expression, marital, civil union or domestic partnership status, past or present military service, family medical history or genetic information, family or parental status, or any other status protected by the laws or regulations."
"https://www.glassdoor.com/job-listing/vision-and-perception-software-engineer-concordia-technologies-inc-JV_IC1127653_KO0,39_KE40,66.htm?jl=1009080946231",Alabama,Concordia Technologies Inc.,Fulltime,3,"Ph.D., Master, Bachelor's degree","Concordia Technologies is seeking a talented and versatile Robotics Software Engineers to join our team. You'll be at the forefront of developing innovative software solutions for next-generation robots and drones, shaping the future of intelligent automation.Responsibilities:Apply computer vision techniques for image recognition and object tracking.Develop algorithms for object detection, tracking, and pose estimation using monocular cameras.Implement algorithms for navigation, obstacle avoidance, perception, and decision-making.Integrate computer vision algorithms with control systems for real-time feedback.Design and execute hardware-in-the-loop (HIL) testing for validating software performance.Optimize software for efficient performance on ARM and NVIDIA platforms.Implement efficient algorithms for systems on drones and mobile robots.Leverage GPU capabilities for parallel processing and machine learning tasksCollaborate with hardware engineers, mechanical engineers, and other software engineers to ensure efficient integration of software and hardware.Qualifications:Only U.S. citizen with the ability to obtain a security clearance will be consider.One of the following:- Bachelor's degree in Computer Science, Robotics, or a related field with 3+ years of relevant experience in the robotics/drone industry.- Master's degree or Ph.D. in Robotics, Control Systems, Computer Vision, or relevant field with experience in applying your knowledge to real-world robotic or drone systems.3+ years of experience developing software for systems, especially autonomous platforms.Experience with computer vision libraries and image processing algorithms.Excellent problem-solving skills and a hands-on approach to engineering.Strong communication and collaboration skills.Bonus:Experience with NVIDIA Jetson platform programming and libraries like CUDA, TensorRT, and DeepStreamExperience with optical tracking systems and sensor fusion algorithms.Familiarity with machine learning and artificial intelligence techniques for on-device deployment on embedded platforms.Experience with drone (UAV) software development and flight control systems.Experience with robot software frameworks (e.g., ROS, ROS2, PX4) and robotics simulation platforms such as GazeboWhat we offer:The opportunity to work on cutting-edge robotics and drone projects with real-world impact.A collaborative and fast-paced work environment with passionate engineers.Competitive salary and benefits package.Continuous learning and growth opportunities.If you're ready to take your career to the next level and become a pioneer in the world of robotics, we encourage you to apply!Job Type: Full-timePay: $85,000.00 - $165,000.00 per yearBenefits:401(k)401(k) 5% MatchBereavement leaveDental insuranceDependent health insurance coverageDisability insuranceFamily leaveHealth insuranceLife insuranceMilitary leavePaid holidaysPaid jury dutyPaid time offParental leaveRetirement planTuition reimbursementVision insuranceCompensation package:Weekly payExperience level:3 yearsSchedule:8 hour shiftMonday to FridayAbility to Relocate:Huntsville, AL 35805: Relocate before starting work (Required)Work Location: In person"
"https://www.glassdoor.com/job-listing/senior-software-engineer-home-franchise-concepts-JV_IC1127429_KO0,24_KE25,48.htm?jl=1009102104420",Alabama,Home Franchise Concepts,Hybrid,6,,"About the Company  Home Franchise Concepts is one of the largest franchising systems in the home improvement goods and services space. The Company’s brands: Budget Blinds, Tailored Living, Premier Garage, AdvantaClean, Kitchen TuneUp, Bath Tuneup, Two Maids, Aussie Pet Mobile and Concrete Craft are consistently rated at the top of their categories and supported by more than 3,500 franchise territories in the U.S., Canada and Mexico.  Home Franchise Concepts is a subsidiary of JM Family Enterprises, a family-owned, professionally managed diversified automotive company. To diversify their portfolio, JM Family acquired Home Franchise Concepts in 2019 as their first non-automotive acquisition. The Company fit JM Family’s key investment criteria: asset-light with strong free cash flow characteristics and a track record of growth in an industry with long-term tailwinds. Since the acquisition, the Company has doubled the number of brands under management and is committed to continued, rapid profitable growth.  A few of the Company’s many Accolades and Awards  Entrepreneur’s Franchise 500 Entrepreneur’s Franchise 500 Best in Category Entrepreneur’s Top Low-Cost Franchise Entrepreneur’s Top New & Emerging Franchises Entrepreneur’s Top Home-based Franchises Entrepreneur’s Top 100 Global Franchises   Home Franchise Concepts is looking for a Senior Software Engineer to drive development of our franchisee and customer-facing software systems, apps, and websites, to help deliver on the promise of great service in the home services industry. Experience with full-stack development technologies, database systems and operating practices and principles will be critical to success. Our candidate’s success will also be based on an ability to understand complex problems, conceptualize effective solutions, and communicate effectively at all levels.   Essential Job Functions:  Deliver ongoing feature development and maintenance of operator and customer-facing systems Assist with applying frameworks and practices like Agile, DevOps, code reviews, and testing best practices Provide effort estimation and task decomposition for roadmap and backlog development tasks Work closely with business teams and IT resources to enable new business solutions through technology systems Develop software architectural specifications that will deliver efficient, scalable, and reliable business solutions Design and develop software applications, including coding, debugging, testing, and troubleshooting Comprehend and develop against complex technical and business concepts Design, develop, implement, and maintain builds, scripts, installation procedures, and source control Design, develop, manage, and maintain relational databases in PostgreSQL and MS SQL Server Manage database backups, capacity planning, performance tuning, and user access Provide guidance and mentorship for our IT team, and direct vendors and vendor resources Seek out and identify areas for improvement for the team and technology  Analyze application performance in a variety of environments, design and implement optimizations   Skill Requirements:  Proficient in multiple software development languages including, Python, Bootstrap, Django, React, React Native, Next. JS, Docker, and the like Previous experience leading software development teams using agile methodologies Experienced with modern continuous integration practices   Qualifications:  6 years experience in development teams and environments Strong business, analytical, and problem solving skills Efficient and effective documentation skills Fundamental analytical and conceptual thinking skills Comfortable expressing ideas, plans, and concepts in front of leadership, team members, and small or large groups of franchisee owners  #LI-Hybrid  #HP2023  To perform this job successfully, an individual must be able to perform each essential job function satisfactorily. The requirements listed above are representative of the knowledge, skill, and/or ability required. Reasonable accommodations may be made to enable individuals with disabilities to perform the essential functions."
"https://www.glassdoor.com/job-listing/software-application-developer-offset-strategic-services-llc-JV_IC1127653_KO0,30_KE31,60.htm?jl=1009102074727",Alabama,"Offset Strategic Services, LLC",Fulltime,4,MA,"OSS is a Service Disabled Veteran Owned Small Business headquartered in Huntsville, AL. We are focused on ""Making a Difference"" in the lives of our Department of Defense Customers, Communities, and Employees. Our greatest strength is our people. We expect competence and character and look for uniquely skilled and passionate individuals bound by a collective vision to bring their best to our mission. OSS believes in taking great care of our employees, evidenced by our exemplary benefits package: OSS covers 75% of the monthly insurance cost towards employee Health Insurance, we offer multiple Principal product options, and we have a fantastic 401k plan match with eligibility to start immediately upon hire. If you are interested in an opportunity to join a great mission, supporting awesome customers with a growing company, please reach out to us to learn more!OSS is seeking a talented software application developer that is excited about learning new technologies, and is both a team player and capable of leading full lifecycle application development efforts. The initial focus will be implementing enhancements to an existing application utilizing C#, and we anticipate on-going new requirements and new development opportunities for this position going forward. This is position currently allows for 2 days/week telework and 3 days/week on-site for one of our valued government customers. You must have excellent communication and documentation skills, and thrive in a fast-paced environment. Our primary objective is to provide our customers with outstanding support and dedication to help them fulfill their mission.Requirements:4+ years' experience developing applications utilizing C# or C++Bachelors Degree in Computer Science, Management Information Systems, or related fieldAbility to attain Secret Security Clearance (required before starting)Skilled in user interface development and data visualizationSelf-starter that looks for the next priority task to work once the task at hand is accomplishedAbility to keep stakeholders informed of project timelines and changesExcellent organizational, time-management, and verbal/written communication skillsEnjoys and excels working in a team environmentPreferred:CompTIA Security+ certification (or equivalent)Experience working with NI LabView and/or MATLABExperience in translating informal customer requirements into technical requirements, to include business process mapping, interface design, business rules, and database design.Advanced proficiency in Microsoft ExcelSecurity Clearance is required - therefore, only US citizens can be considered.Offset Strategic Services, Inc. is an Equal Opportunity employer. We prohibit discrimination and harassment of any type. All applicants will be considered for employment without regard to race, color, age, religion, sex, sexual orientation, genetics, gender identity, national origin, protected veteran or disability status or any other characteristic protected by federal, state or local laws. This policy applies to all terms and conditions of employment, including recruitment, hiring, placement, promotion, termination, layoff, recall, transfer, and compensation. We are committed to providing access, equal opportunity and reasonable accommodation for individuals with disabilities. To request a reasonable accommodation, please email us from our website contact link.ExperienceRequired4 or more years of experienceSkillsPreferredC++BehaviorsPreferredDetail Oriented: Capable of carrying out a given task with all details necessary to get the task done wellTeam Player: Works well as a member of a groupEnthusiastic: Shows intense and eager enjoyment and interestEqual Opportunity Employer/Protected Veterans/Individuals with DisabilitiesThe contractor will not discharge or in any other manner discriminate against employees or applicants because they have inquired about, discussed, or disclosed their own pay or the pay of another employee or applicant. However, employees who have access to the compensation information of other employees or applicants as a part of their essential job functions cannot disclose the pay of other employees or applicants to individuals who do not otherwise have access to compensation information, unless the disclosure is (a) in response to a formal complaint or charge, (b) in furtherance of an investigation, proceeding, hearing, or action, including an investigation conducted by the employer, or (c) consistent with the contractor’s legal duty to furnish information. 41 CFR 60-1.35(c)Job Type: Full-time"
"https://www.glassdoor.com/job-listing/software-developer-ii-ent-university-of-alabama-at-birmingham-JV_IC1127429_KO0,25_KE26,61.htm?jl=1009104949685",Alabama,University of Alabama at Birmingham,Hybrid,not given,Bachelor's degree,"Description FOR USE BY IT AND HSIS ONLY: The University of Alabama at Birmingham (UAB) seeks a SOFTWARE DEVELOPER II-ENT to develop, code, test, and debug new software or enhancements to existing software for their party customers. To work with technical staff to understand problems with software and resolve them. To resolve customer complaints with software and responds to suggestions for improvements and enhancements from third party customers. To assist in development of software user manuals. To demonstrates software to customers. This position will commit to fostering an environment of heightened security following Information Technology Security Policies and participating in security training, such as Health Insurance Portability & Accountability Act (HIPAA) and Family Education Rights and Privacy Act (FERPA), on an annual basis.  Responsibilities for this position include, but are not limited to the following: Develop C# .NET applications Support vendor applications Create and maintain PBRS reports Additional adhoc Research Support projects  (Annual Salary: $67,070 - $108,990)  Qualifications Bachelor's degree in Information Systems or a related field and two (2) years of related experience required. Work experience may substitute for education requirement. In general, three (3) years of work experience or training in the field is considered as equivalent to one (1) year of college.  Preferred skills: C# Broad troubleshooting skills SQL scripting skills Advanced development experience Strong communication skills Team player and self starter  Primary Location: University Job Category: Information Technology Organization: 191401000 Enterprise Applications Employee Status: Regular Shift: Day/1st Shift Work Arrangement (final schedule to be determined by the department/hiring manager): Hybrid Eligible"
"https://www.glassdoor.com/job-listing/software-developer-motion-JV_IC1127429_KO0,18_KE19,25.htm?jl=1009112913688",Alabama,Motion,,not given,MA,"SUMMARY The Software Developer develops information systems by designing, developing, and installing software solutions. This position improves operations by conducting systems analysis and recommending changes in policies and procedures. JOB DUTIES Designs and constructs moderately complex interfaces between ERP and legacy systems. Uses back-end programming languages, as well as front-end script languages to optimize performance, scalability, and security. Codes programming logic for new or existing solutions software or applications in accordance to design specifications put in place by senior software development staff and leadership. Handles installation, configuration, development, workflow design, monitoring, and/or upgrade of assigned software products. Monitors quality and performance of applications through testing and maintenance. Maintains up-to-date records of issues with existing code. Suggests viable solutions to resolve issues with existing software. Performs other assigned duties.  EDUCATION & EXPERIENCE Typically requires a bachelor’s degree in computer science, software engineering, or a related field Three (3) to five (5) years of back-end programing languages (ASP Java, Perl, C++, etc.) and front-end scripting languages (HTML5, JavaScript, CSS) or an equivalent combination.  KNOWLEDGE, SKILLS, ABILITIES Manages multiple tasks simultaneously while meeting deadlines. Possess the latest knowledge on new technology and computer systems. Communicates complex procedures to other colleagues. Understands the latest trends and their role in a commercial environment. Pays close attention to detail and desires to probe further into data.  PHYSICAL DEMANDS: LICENSES & CERTIFICATIONS: None required.  SUPERVISORY RESPONSIBILITY: No Supervisory Responsibility  BUDGET RESPONSIBILITY: No  COMPANY INFORMATION: Motion Industries offers an excellent benefits package which includes options for healthcare coverage, 401(k), tuition reimbursement, vacation, sick, and holiday pay. Not the right fit? Let us know you're interested in a future opportunity by joining our Talent Community on jobs.genpt.com or create an account to set up email alerts as new job postings become available that meet your interest! GPC conducts its business without regard to sex, race, creed, color, religion, marital status, national origin, citizenship status, age, pregnancy, sexual orientation, gender identity or expression, genetic information, disability, military status, status as a veteran, or any other protected characteristic. GPC's policy is to recruit, hire, train, promote, assign, transfer and terminate employees based on their own ability, achievement, experience and conduct and other legitimate business reasons."
