ID,URL,Location,Company,Employment Type,Years of Exp,Education Level,Data
229130,https://www.ergodotisi.com/en/JobDetails/229130/Gamingtec,Limassol,Gamingtec,Fulltime,3,,"  Senior DevOps Engineer    Limassol CY    Casino Computer Science, Casino, Work from home   Gamingtec   We are seeking for a Senior DevOps Engineer to join our team.   11/7/2023 12:00:00 AM 12/7/2023 12:00:00 AM     Senior DevOps Engineer new REF. NUM: 229130     Limassol  posted 6 days ago     Gamingtec  expires in 24 days    139            CATEGORY: Computer Science, Casino, Work from home  PUBLISHED BY: Private Company (LTD)   EMPLOYMENT TYPE: Fulltime INDUSTRY: Casino      APPLY ONLINE   Are you ready to take your DevOps skills to the next level?We are seeking for a Senior DevOps Engineer to join our team. The successful candidate will have a minimum of 3 years of experience in DevOps. In this role, you will work with technologies such as Docker, Kubernetes, GitLab CI/CD, AWS, and the ELK stack, and will be responsible for ensuring the stability and reliability of our applications and infrastructure.All you need is:3+ years of experience as a SRE, DevOps or similar role and an ability to demonstrate skills and competence in:Experience working and configuring Nginx, Apache.Databases: PostgreSQL, MySQL, Redis, Mongo.Experience with k8s, Helm, Docker, Git.Experience with AWS, as well as other hosting service providers.Knowledge of scripting programming languages such as Python and/or similar.Experience with logging and monitoring: ELK stack, Prometheus and/or similar.DDoS protection experience.At least the Upper-Intermediate level of English.Your daily adventures will look like:Support and assistance with multiple projects' infrastructure.Build and improve CI/CD processes.Documenting processes and performance metrics.Collaborating with developers on software requirements and architecture.Incident mitigation, evasion and postmortem investigation.In-depth technical assistance for the customer support team.So, why Gamingtec?If you are a person with passion, ideas, and a thirst to advance your career, you will love our corporate culture. We are an international team that treats each other with respect and moves towards the same goals. We believe in freedom and flexibility and trust our employees to do their jobs in a way that works for them. We have an ambitious and rewarding work environment, a flat organizational structure and almost zero bureaucracy. Our employees’ ideas are what move the company forward. Everyone has equal opportunities in every aspect of work, learning and development!Why you will love working here:Being a part of an international team, where everyone treats each other with respect and moves towards the same goal.Freedom and responsibility. You do not need to be told what to do.Competitive salaries. We want only the top performers, so we offer the appropriate remuneration for their experience and knowledge.Fully remote work. If you are in one of the areas where one of our offices is located, you will also have the option to go to the office.Flexible work schedule. We do not track time, we measure performance.Unlimited paid vacation and sick leave days. We believe that everyone should have a good work-life balance and no one should burn out.Constant career development & learning opportunities!Enjoy the corporate atmosphere with awesome parties and team-building events throughout the year.Refer your friends and get rewarded with a bonus, after they pass their probation period.Find the right private medical insurance that works for you and receive compensation for it. Compensation (full/partial) depends on the cost.Flexible Benefits plan. Decide which of your activities/expenses you want the company to compensate you for. For example, gym subscription, language courses, Netflix subscription, a spa day, etc.Education foundation in learning something new. Be part of our biannual ruffle that gives you the chance to learn something new, unrelated to your job.And this is how our interview process goes:A 30-minute interview with a member of our HR team to get to know you and your experience.A technical interview with our Lead DevOps to assess your skills and abilities.A final 1-hour interview with 2 team members to gauge your fit with our culture and working style.Sounds interesting? Do not hesitate to apply or contact us if you have any questions! Gamingtec is waiting for you!  "
226741,https://www.ergodotisi.com/en/JobDetails/226741/Correct-Group-Ltd,Limassol,Correct Group Ltd,Fulltime,not given,,"  IT Engineer (SysAdmin)     Limassol CY    Technology Industry Computer Science   Correct Group Ltd   Correct Group is looking for an IT Engineer (SysAdmin) for our expanding office in Limassol, Cyprus!   10/17/2023 12:00:00 AM 11/17/2023 12:00:00 AM     IT Engineer (SysAdmin)  new REF. NUM: 226741     Limassol  posted 27 days ago     Correct Group Ltd  expires in 4 days    264            CATEGORY: Computer Science  PUBLISHED BY: Private Company (LTD)   EMPLOYMENT TYPE: Fulltime INDUSTRY: Technology Industry        About the job:Correct Group is a dynamic and fast growing Managed Service Provider, based in the heart of London’s Kentish Town where employees are encouraged and supported to develop their skills as part of an excellent, hard working team.We are expanding our IT SeviceDesk in Cyprus at the vibrant city of Limassol!Visit our website to see what we are all about: www.correct-group.co.ukNo two clients of Correct Group are the same: each company has different needs requirements and we provide the right technologies to meet them, including Microsoft, Apple, Google and many other vendors. You will be exposed to varied and new challenges on a daily basis, in a fun and fast paced environment that allows you to learn and develop as a professional.Correct Group is a leading provider of voice and data managed solutions.We are now seeking an IT Engineer to join our team.This is the ideal role for an articulate and professional IT Engineer, looking to develop their career with a successful and innovative company. You will get the opportunity to develop your IT Skills and have the opportunity to move into Higher Level IT Support and Projects.As an IT Engineer, you will be responsible for resolving issues and problems with customers' IT infrastructure. It is imperative that you can communicate clearly and accurately in English with a professional matter.This position will provide Client support for all desktop and server related issues via telephone, email and remote connections. In addition to staying abreast of industry trends and best practices, you will provide technical assistance to computer system users including problem assessment/resolution and software and hardware installation and configuration, where necessary.In addition to proactively improving customers' infrastructure, you will be tasked with contributing to your customers' IT strategic decision making, providing insight and proposing solutions to IT issues. You will also be required to record and document system settings and resolutions within the company’s client management system.As a IT Engineer with us, you must be an excellent communicator with strong interpersonal skills and the ability to build effective relationships. Attentive and customer focused, you must also have the ability to prioritise your workload effectively.To be considered, you must have:Excellent Customer Service SkillsExcellent English with active listening, written and verbal communication skills.Experience in IT Support.Experience in Configuring, Administering and Troubleshooting Microsoft environments and devices.Familiarity and Experience with MAC Environments will be considered as an advantage.Familiarity and Experience with Google Apps will be considered as an advantage,Adhere to departmental procedures to ensure clients are kept well informed of ticket status and product availability in order to manage client expectation and ensure overall client satisfaction.What we offer:Working hours: 10am - 7pm13th SalaryYearly Salary Range: €15,000 - €30,000 (depending on skills and experience)Casual Day Every Day!Beverages and Snacks - Yes also chocolates!Company Lunch Days!CSR Bonding Events!Contact us on careers@correct-group.co.uk  "
227947,https://www.ergodotisi.com/en/JobDetails/227947/FXGT-Careers,Limassol,FXGT Careers,Fulltime,2,,"  QA Engineer    Limassol CY    FinTech Computer Science, Mechanical Engineers   FXGT Careers   We are looking for an experienced QA Engineer, to help us maintain our level of quality and reliability.   10/26/2023 12:00:00 AM 11/26/2023 12:00:00 AM     QA Engineer new REF. NUM: 227947     Limassol  posted 18 days ago     FXGT Careers  expires in 13 days    424            CATEGORY: Computer Science, Mechanical Engineers  PUBLISHED BY: Private Company (LTD)   EMPLOYMENT TYPE: Fulltime INDUSTRY: FinTech        We are looking for an experienced QA Engineer, to help us maintain our level of quality and reliability. By joining our team, you will be assessing software quality by designing and implementing software testing processes. You will be responsible on maintaining the code quality through exploratory and automated tests. You will be searching for bugs, identifying issues, reporting them, and making sure that they are being resolved by our development team. If you enjoy working in a fast-paced environment and being a member of a goal-oriented team, then you are fit for the role!  Job ResponsibilitiesUnderstand and analyze business requirements, features, and technical implementationCreate and execute test cases and report testing status to project teams, in order to identify software problemsWork closely with development team to analyze and resolve conflictsDesign, develop and execute automation scripts using testing toolsRaise and analyze bugs and errors found during testsDocument results of tests for the software development teamExecute manual test cases on areas that cannot be automatedPerform regression testing when bugs are resolvedMotivate the development process for efficiency and performanceRecommend improvements in software to enhance user experienceEnhance software delivery and quality throughout the entire software development cyclePost-production deployment validationsStay up to date with new testing tools and test strategiesJob Requirements Degree in Engineering, Computer Science, or similar fieldMinimum 2 years of experience in quality assurance and test automationKnowledge of and experience with QA methodologiesExperience in performance testing, integration testing and test automation (e.g, Selenium or similar) will be consider as an advantagePractical software development experience on any programming language will be a strong plusExperience in agile software development methodologies and testing proceduresTeam player with excellent written and verbal communication skillsExcellent written and verbal skills in EnglishAbility to quickly learnGrowth mindset, challenging status quo to find new solutions and out-of-the-box ideasSelf-motivated and self-managing, with excellent organizational skillsThe ability to communicate complex procedures to other colleaguesAttention to detail and desire to probe further into dataBenefitsAttractive remuneration packageCorporate fund schemeDiscretionary bonus based on company's and personal performanceDiscount benefit cardReferral BonusFriday Lunch and daily snacks and beverages at the officeYearly Training Budget – Udemy membership per departmentTraining opportunities for growth and personal developmentUp to 25 days holidays per yearHybrid working model Please apply to: https://fxgt.bamboohr.com/careers/61  Please note that due to the high volumes of applications received only shortlisted applicants will be responded to.  "
228172,https://www.ergodotisi.com/en/JobDetails/228172/Factory-39,Limassol,Factory 39,Fulltime,3,,"  Mid Back-End Software Development Engineer    Limassol CY    Technology Industry Computer Science   Factory 39   We are looking to expand our team with a Mid Back-End Software Development Engineer who is eager to learn and wants to join a fast-growing company.   10/30/2023 12:00:00 AM 11/30/2023 12:00:00 AM     Mid Back-End Software Development Engineer new REF. NUM: 228172     Limassol  posted 14 days ago     Factory 39  expires in 17 days    204            CATEGORY: Computer Science  PUBLISHED BY: Private Company (LTD)   EMPLOYMENT TYPE: Fulltime INDUSTRY: Technology Industry        A little about us A place where ideas come to life and products reach the shelves. We work with brands and companies that need to build their internal and external brand, develop new technologies, raise awareness and develop trust and loyalty with their customers. We are strategic in everything we do and our motto is “Do it nice, or do it twice”.Our culture We are a very tight team of dedicated professionals that love what we do and strive to improve and learn something new every day. We build simple and reliable systems on top of modern yet battle-tested technologies we deeply understand and trust, and primarily use Java, Kotlin, and Ruby. We treat our customers as partners and strive to create relationships based on trust. Many of our customers stay with us for several years and we like to hang out with them whenever possible. For us, each touch point of our brand is an opportunity to create a memorable experience and to build a long lasting relationship.The Role We are looking to expand our team with a Mid Back-End Software Development Engineer who is eager to learn and wants to join a fast-growing company. The ideal candidate will have a passion for solving problems, writing excellent well-tested code, developing software at scale, and deploying to cloud environments. You will have Java, Kotlin, or other relevant object oriented programming experience.Responsibilities:Participate and contribute to design and code reviews to produce quality codeConduct thorough testing of feature functionalitiesManage small projectsWork efficiently with peers to solve complex problems, as well as raising appropriate issues to the team-leadRequirements:You have demonstrable experience (1-3 years) writing objected-oriented code in Java using the Spring/Spring Boot framework (Kotlin is a plus)You have experience in building a backend service with Spring and deploying to productionYour code is well-structured and readable, fits into existing frameworks, adheres to best design patterns, and has good exception handlingYou are able to test code appropriately (UnitTest with Mockito, familiar with concept of integration/endToEnd tests and Spring Boot Tests)You have some Observability experience / looking after a system in ProductionYou are passionate about being up-to-date with the latest development of technologies, and are interested in finding ways to apply themYou demonstrate solid reasoning for your design choices, and always consider alternativesYou are able to identify and analyse issues in design/code, and are starting to debug others’ codeYou are a strong communicator, are highly dependable and enjoy working within a diverse teamYou get extra credit for: Unix/Linux system administration experience You have worked in an agile team with use of Jira or other similar issue tracking productsA Computer Science or other related degree What you get We believe our values and work environment are the biggest benefits we offer. We take them extremely seriously and they are at the core of what we do. Plus we have some cool perks: A competitive salary with regular pay reviews and bonuses A very bright office - 5 minutes walk from the sea that will come very handy in the summerHealthy tech budget to make sure you’ve got your perfect work set-upGenerous personal development budget and dedicated company-wide hack days focused on employee growthA well deserved time off with 23 days of paid holidayFlexible work environment and hours, we care that you get the job done not when and where (start and finish almost when you want)Hybrid-remote work modelA treat on your birthday! Friday drinks Access to a pool table plus a PS4 2 lovely dogs for emotional support on those rare, rainy MondaysA few of our unforgettable parties across the yearSeveral team activities from go karting, to hiking, passing from pottery class.Sounds interesting? Please send over your CV and a short cover letter here.  "
229563,https://www.ergodotisi.com/en/JobDetails/229563/ACE-Networks,Limassol,ACE Networks,Fulltime,18,,"  Network Engineer    Limassol CY    Computer Science Computer Science   ACE Networks   AceNetworks is seeking to recruit a Network Engineer.   11/10/2023 12:00:00 AM 12/10/2023 12:00:00 AM     Network Engineer new REF. NUM: 229563     Limassol  posted 3 days ago     ACE Networks  expires in 27 days    131            CATEGORY: Computer Science  PUBLISHED BY: Private Company (LTD)   EMPLOYMENT TYPE: Fulltime INDUSTRY: Computer Science        AceNetworks is an Information Telephony Computing (ITC) Development and IT Consulting company with more than 18 years of experience in the market. We have been providing outsource IT services and Voice over IP (VoIP) telephone since 2005. Our clientele consists of many international corporations in different areas, and we are involved in projects that demand leading edge information technology skills. About the position. On behalf of our client, an international company in Hospitality & Gaming Industry located in Limassol, we are seeking to recruit highly capable and experienced candidate for the position of Network Engineer to join their expanding team.   Our dream candidate must be enthusiastic about Technology and a very good team player. If that describes you then please keep on reading. Primary Responsibilities: Provide daily monitoring, analysis, and administration of network operationsProvides guidance and advisory to technical support in the installation and maintenance of networksInstall and build network infrastructure for multiple propertiesEvaluate hardware and software solutions for suitable network implementationPlans and configures monitoring tools to ensure service level are metTroubleshoot and resolve networking problemsProvides technical and operation support as well as conduct training to end usersMaintains inventory listing of LAN/WAN deployment Qualifications Requirements: Degree Computer Science or any related field3+ years of relevant IT network experiencePreferred CCNA/CCNP certificatesExcellent knowledge and experience in computer/network security, network security software, IP addressing schemes, penetration testingExperience with routing and switching technologiesExperience on VLAN, Firewall, EIGRP, OSPF, BGP, VPN, port security, IPS and High availability setupExperience in structure cabling system with CAT and fibre cablesFluency in English and GreekExcellent troubleshooting skills and fast technology learnerAbility to work under pressure Company offers:  An attractive remuneration package according to qualifications and experienceExcellent opportunities for career development and advancement An array of paid trainings will be offeredFree meals and beverages at the in-house cafeteria All CVs will be handled with the utmost confidentiality.  To apply please send us your CV to vacancies@acenetworks.eu Only applicants whose previous experience and qualifications closely match the requirements of the position will be contacted.  "
229546,https://www.ergodotisi.com/en/JobDetails/229546/ACE-Networks,Limassol,ACE Networks,Fulltime,5,,"  Project Engineer (Infrastructure Integration)    Limassol CY    Computer Science Computer Science, HORECA employees, Finance, Casino   ACE Networks   AceNetworks is seeking to recruit a capable Project Engineer (Infrastructure Integration).   11/10/2023 12:00:00 AM 12/10/2023 12:00:00 AM     Project Engineer (Infrastructure Integration) new REF. NUM: 229546     Limassol  posted 3 days ago     ACE Networks  expires in 27 days    132            CATEGORY: Computer Science, HORECA employees, Finance, Casino  PUBLISHED BY: Private Company (LTD)   EMPLOYMENT TYPE: Fulltime INDUSTRY: Computer Science        Position Summary: On behalf of our client, an international company in the Hospitality & Gaming Industry located in Limassol, we are seeking to recruit highly capable candidate for the position of Project Engineer (Infrastructure Integration) to join their expanding team. Responsible for the quality and timeliness of project deliverables. Assist to plan and establish the design of company’s IT Infrastructure requirements of new property and existing properties. Collaborate with the team by providing guidance and solving problem, recording progress and documents preparation. Work closely with various company Departments and Vendors to ensure the Implementation of the Project is according to the project plan and on budget.Primary Responsibilities:Assist to design and implement of Enterprise Data Centres, ELV rooms, property-wide structured cabling, patching standard for new properties and A&A work.Assist in the Project Planning works related to the design of company-wide IT Infrastructure.Help to work effectively with company’s Construction Project Team and BUs to collect requirements and define timeline.Assist to organize and maintain the necessary communication amongst the project team’s business stakeholders, vendors and IT Department.Follow established processes used to ensure proper review and maintain service standards defined in the design of IT Infrastructure.Maintain tasks such as maintaining records and drawing schematics of the Data Centre and ELV rooms in detail to reflect what equipment is installed.QUALIFICATIONSExperience: Minimum of 2 - 5 years’ experience in IT industry working in a similar capacityExperience working in a high- pressure, 24/7 environment.Experience to install/move/design IT Infrastructure on a large-scale basis (e.g., data centres, cabling, etc.)Experience in working with Building Construction or IT Facilities Management team.Experience in supporting & maintaining a small to large scale IT Infrastructure Education: Bachelor’s degree in technology, Engineering, or a related field.ITIL v3 Foundation certified.PMP or Prince2 certified is preferred but not required. Skills / Competencies: Experience in implementation of IT infrastructure, networking and storage hardware.Experience in Hospitality, Gaming or Financial Services sector is a plus.Technical understanding relating to the design, implementation and support of enterprise network, system (server, storage, backup) telephony and end-user computing environments.Good understanding of projects management fundamentals.Ability to work well with people from different disciplines with varying degrees of technical experience.Technical writing skills, understanding of technical manuals, software specifications, hardware principles and operations, and general methods of system operations.Problem solving analysis and decision-making skills.Must be able to successfully manage multiple priorities and projects with critical deadlines.Excellent written and verbal communication skills in English and Greek.Organized and detail oriented, able to multi-task. Remunaration and BenefitsAn attractive remuneration package according to qualifications and experience.Free meals and beverages at the in-house cafeteriaAn array of paid trainings will be offered.Excellent opportunities for career development and advancementAll CVs will be handled with the utmost confidentiality.  To apply please send us your CV to vacancies@acenetworks.eu Only applicants whose previous experience and qualifications closely match the requirements of the position will be contacted.   "
