ID,URL,Location,Company,Employment Type,Years of Exp,Education Level,Data
226465,https://www.ergodotisi.com/en/JobDetails/226465/Cycom-Business-Solutions-Ltd,"Famagusta, Larnaca, Paphos, Limassol, Nicosia",Cycom Business Solutions Ltd,Fulltime,not given,,"  Software Engineer (Nicosia & Limassol)    Limassol, Nicosia, Larnaca, Paphos, Famagusta CY    Technology Computer Science   Cycom Business Solutions Ltd   The successful candidate will be part of the Software Engineering team, responsible for developing, testing, and maintenance of Cycom ERP.   10/13/2023 12:00:00 AM 11/13/2023 12:00:00 AM     Software Engineer (Nicosia & Limassol) new REF. NUM: 226465     Limassol, Nicosia, Larnaca, Paphos, Famagusta  posted 31 days ago     Cycom Business Solutions Ltd  expires today    613            CATEGORY: Computer Science  PUBLISHED BY: Private Company (LTD)   EMPLOYMENT TYPE: Fulltime INDUSTRY: Technology        Who we are: CYCOM Business Solutions Ltd operates in the Information Technology sector of Cyprus and provides robust software solutions for today’s demanding and competitive business environment. CYCOM's product suite includes Financial, Inventory, Human Resources, and Customized applications. Roles/Responsibilities: The successful candidate will be part of the Software Engineering team, responsible for developing, testing, and maintenance of the new modules Cycom Sofia Applications to the existing ERP systems.General Requirements:  University Degree in Computer Science / Software Engineering. Analytical mind with problem-solving aptitude. Excellent command of the English and Greek language. Knowledge of Object-Oriented Programming. Visual Studio, VB.NET, ASP.NET, HTML, Java, Oracle, SQL, Crystal Reports. Adherence to schedules. Good attention to details. Integrity of character, professionalism and excellent interpersonal relationships. Experience in a similar position will be considered an additional advantage. Company Offers: A competitive remuneration package will be offered to the successful candidate according to qualifications and experience.13th salary, Provident Fund.Professional team and friendly environment.Continuous personal development and internal training and opportunities. Interested candidates are kindly requested to send their CVs to arisy@cycom.com.cy by 13/11/2023.  "
228459,https://www.ergodotisi.com/en/JobDetails/228459/XM,"Famagusta, Larnaca, Paphos, Limassol, Nicosia",XM,Fulltime,2,,"  Site Reliability Engineer (Cyprus/Greece)    Limassol, Nicosia, Larnaca, Paphos, Famagusta CY    Forex Computer Science, Forex   XM   Seeking to recruit a Site Reliability Engineer (Cyprus/Greece).   11/1/2023 12:00:00 AM 12/1/2023 12:00:00 AM     Site Reliability Engineer (Cyprus/Greece) new REF. NUM: 228459     Limassol, Nicosia, Larnaca, Paphos, Famagusta  posted 12 days ago     XM  expires in 18 days    883            CATEGORY: Computer Science, Forex  PUBLISHED BY: Private Company (LTD)   EMPLOYMENT TYPE: Fulltime INDUSTRY: Forex        Site Reliability Engineer (Cyprus/Greece)The Role:  You will join a team working with cutting-edge technologies and striving to utilize cloud services to the maximum. Your role will be to monitor critical applications and services to ensure their availability and minimize downtime. You will also ensure that the underlying infrastructure runs smoothly and systems/tools work as expected, help developers with troubleshooting and provide consultation in case of alerts. The main responsibilities of the position include: Monitor critical application metrics and create alertsBuild or use software to help DevOps, Devs and Support teamsFix support escalation issuesMaintain documentation and runbooksConduct post-incident reviews Main requirements: 2+ years of experience in a similar roleExperience in incident, problem and change management practicesExtensive working experience with CI/CD procedures and tools (e.g. Gitlab CI)Strong experience using containers and KubernetesExperience with Infrastructure as Code (Terraform, CloudFormation)Ability to work as part of a distributed teamExperience with monitoring tools (Prometheus, Grafana, New Relic) The following will be considered an advantage:  Familiarity with database conceptsWorking experience with at least one cloud provider (preferably AWS)Experience with Apache Kafka configuration and troubleshootingExperience with ELK configuration and troubleshootingScripting skills (Bash, PowerShell, Python, Go, etc.) Benefit from: Attractive remuneration package Private health insurance Corporate pension fund Food allowance Intellectually stimulating work environmentContinuous personal development and international training opportunities Type of employment: Full time Location: Cyprus or Greece Please visit our website www.xm.com/careers to submit your online application for this position. All applications will be treated with strict confidentiality!  "
229254,https://www.ergodotisi.com/en/JobDetails/229254/V.D.-COMPUTERLAND-CENTRE-LTD,"Limassol, Nicosia",V.D. COMPUTERLAND CENTRE LTD,Fulltime,not given,,"  IT Support Engineer     Limassol, Nicosia CY    Computer Science Customer Service, Computer Science   V.D. COMPUTERLAND CENTRE LTD   Looking for high-calibre and professional IT Support Engineer with experience in IT Support and Networking to join our Team's in Limassol and Nicosia.   11/8/2023 12:00:00 AM 12/8/2023 12:00:00 AM     IT Support Engineer  new REF. NUM: 229254     Limassol, Nicosia  posted 5 days ago     V.D. COMPUTERLAND CENTRE LTD  expires in 25 days    708            CATEGORY: Customer Service, Computer Science  PUBLISHED BY: Private Company (LTD)   EMPLOYMENT TYPE: Fulltime INDUSTRY: Computer Science        Our company VD Computerland Centre Ltd one of today’s largest IT service companies in Cyprus since 1995 with two store locations in Limassol and Nicosia, aims in providing our market with products and services with the latest technological specifications. Our goal is to offer high-end solutions with the quickest and most professional service. Currently we are looking for high-caliber and professional IT Support Engineers with experience in IT Support and Networking to join our IT Support Team’s in Limassol & Nicosia.Duties and responsibilities: Ability to support existing and new clients either through phone or onsite visits.  You will be part of a talented team of engineers that demonstrate superb technical competency, delivering mission critical infrastructure and ensuring the highest levels of availability, performance, and security. Responsibilities:  Day to day operations, maintenance, monitoring, upgrades of infrastructure solutions for our customers and in-house systemsAdministration and configuration of several clients IT infrastructures Updating and patching of operating systems, equipment software/firmware and equipment replacements/upgrades Providing 2nd line user’s support to ensure SLA complianceHandling incidents and service requests within the Service DeskDeploy/install and configure enterprise IT systems, wired and wireless networks (routers, firewalls, switches, etc.) as well as IP telephony systems, ensuring high quality and timely deliveryCollaborating with internal resources to ensure compliance with and development of information security measures and requirementsAdherence to deadlinesLiaise with vendors and other IT personnel for problem resolutionFulfil any other duties relevant to the job assigned by the company’s management Requirements and skills: University degree in Information Technology, Computer Science, or a related fieldProven experience as a System Administrator or similar roleExperience with installing, configuring, and maintaining IT Equipment Networking / IT Troubleshooting (Windows Server 2008-2019), MS Exchange 2013-2019Good knowledge of Microsoft 365Knowledge of Active Directory, DHCP, etc.Very good knowledge of IT products (hardware)Multitask with corporate partners, IP TelephonyAbility to work under pressure and handle emergency situations effectivelyExcellent knowledge of Greek and English language written and verbal (Russian will be considered an advantage)Certificates of CCNA, MCP, etc. will be considered an advantageExcellent knowledge of virtualization concepts and experience with VMware, Hyper-V, VLAN’s, etc.Assembly of computers and gaming PC’s (advantage)Team Player, honest and reliableHigh degree of professional ethics and integrity  We offer: An attractive remuneration package will be offered to the successful candidate according to qualifications and experience13th SalaryA friendly work environment and benefit to work with cutting edge technologies / productsProfessional growth If you are a strong team player, detailed oriented professional with good attitude and good manners with a strong desire to succeed in this field, if you are looking for a well-established company then this is the role for you.Interested in joining a team of passionate professionals? Apply now at jobs@computerland.com.cyClearly please mention in your application which town you are interested in, Limassol or Nicosia.  "
228038,https://www.ergodotisi.com/en/JobDetails/228038/Island-Oil-(Holdings)-LTD,Limassol,Island Oil (Holdings) LTD,Fulltime,3,,"  Network & Security Engineer    Limassol CY    Shipping companies Computer Science   Island Oil (Holdings) LTD   Island Oil (Holdings) Ltd is seeking to hire a Network & Security Engineer.   10/27/2023 12:00:00 AM 11/27/2023 12:00:00 AM     Network & Security Engineer new REF. NUM: 228038     Limassol  posted 17 days ago     Island Oil (Holdings) LTD  expires in 14 days    260            CATEGORY: Computer Science  PUBLISHED BY: Private Company (LTD)   EMPLOYMENT TYPE: Fulltime INDUSTRY: Shipping companies        Scope of duties This position is responsible to provide support to users of the Company offices and vessels for any IT related issues and checks for any issues regarding hardware and software. The Network and Security Engineer is also responsible to maintain and further develop existing IT Infrastructure. Responsibilities Design, implement, and manage network infrastructure, including routers, switches, firewalls, and VPNs. Monitor network performance, troubleshoot issues, and ensure high availability.Develop and enforce security policies, procedures, and best practices.Respond to security incidents and perform incident analysis and reporting.Stay up to date with the latest security threats and trends and proactively recommend security improvements.Collaborate with the rest of the team to ensure network and security alignment with business goals. Provide guidance and training to team members and end-users on security best practices.Maintains the IT infrastructure.Provides user support for IT related issues of the company and its branch offices.Maintains and supports IT related issues on board company’s vessels.Assists with maintenance of company’s websites.Executes any other duties assigned by the IT Supervisor.Develops automation scripts to automate various tasks.Implements Company’s QMS and makes suggestions for improvements. Required Qualifications / Competencies Bachelor’s degree in Computer Engineering, Information Technology, or in a related field.3+ years of experience in network and security engineering roles.Strong knowledge of network protocols, routing, and switching.Experience with firewall configuration and intrusion detection/prevention systems.Proficiency in network and security tools and technologies.Excellent problem-solving and communication skills.Ability to work independently and as part of a team.Strong commitment to security best practices and continuous learning.2+ on Database administration (Oracle, MS SQL)Experience in development of automation scripts (C#, python, bash) will be considered as an advantage.Analytical mind and problem-solving aptitude.Ability to perform well in a fast-paced environment and meet deadlines.Excellent verbal and written communication skills in both English and Greek languages. All applications will be treated with strict confidentiality.  Applicants must be able to reside & work within EU.  An excellent package, including provident fund and medical insurance will be offered to the successful candidate according to qualifications and experience. If you wish to apply for this position, kindly send your CV at: careers@island-oil.com www.island-oil.com  "
228616,https://www.ergodotisi.com/en/JobDetails/228616/CareerFinders-Recruitment-Services-Ltd,Limassol,CareerFinders Recruitment Services Ltd ,Fulltime,3,,"  Systems Engineer (7102)    Limassol CY    Forex Computer Science   CareerFinders Recruitment Services Ltd    CareerFinders, on behalf of our client, a CySEC regulated Investment Firm with expanding operations in Cyprus, we are seeking a Systems Engineer.   11/2/2023 12:00:00 AM 12/2/2023 12:00:00 AM     Systems Engineer (7102) new REF. NUM: 228616     Limassol  posted 11 days ago     CareerFinders Recruitment Services Ltd   expires in 19 days    234            CATEGORY: Computer Science  PUBLISHED BY: Private Company (LTD)   EMPLOYMENT TYPE: Fulltime INDUSTRY: Forex        CareerFinders, on behalf of our client, a CySEC regulated Investment Firm with expanding operations in Cyprus, we are seeking to recruit a Systems Engineer to join their growing team based in Limassol. Our client is seeking applicants who are ideally educated to degree level in Information Technology, Computer Science or another related field who possess approximately 3+ years of proven experience in a relevant role. You will need to be familiar with both the Linux and Microsoft operating systems, hold sound experience with virtualisation technologies such as VMware and Microsoft Hyper-V, and possess knowledge of cloud-based service providers such as Microsoft Azure and Amazon AWS. Excellent verbal and written communication skills in English are essential. Key Duties/Responsibilities: Cloud infrastructure deployment, configuration and management.Supporting and maintaining the IT infrastructure including but not limited to virtual machines, bare metal servers, network devices and other LAN/WAN services.Work with external fintech providers and vendors.Ensure that the company’s trading infrastructure network is fully functional and secure.Taking ownership of complex technical issues reported and follow through to resolution.Carrying out periodic updates of the operating systems or applicable software.Actively participating in architectural design and evaluation of new technologies and infrastructure.Contributing to infrastructure planning, development, and implementation.Following the relevant IT and security procedures and policies, guidelines, standards and best practices.Effectively contribute to documentation, KB, manuals and support knowledge sharing, within the IT team.Handling incidents, escalations, and providing detailed status reports and updates within the IT team.Outside working hours availability for issues, emergencies and maintenance. Key Skills/Experience: Bachelor’s degree in information technology, Computer Science or equivalent experience or technical certifications.FinTech services technology background is a major advantage.Any IT-related certifications will be considered an advantage, but not essential.3-5 years of experience in a similar positionExperience with Microsoft and Linux operating systems.Experience with virtualization technologies such as VMware and Microsoft Hyper-V Experience with Cloud technologies (AWS, Azure, or similar).Experience with cloud-based service providers such as Microsoft Azure and Amazon AWS.Excellent understanding of web services, DNS and content-delivery platforms.Excellent understanding of TCP/IP, roles of network devices and services.Experience with network monitoring tools and protocols (PRTG, Nagios, Zabbix etc.).Experience with Microsoft Office 365 and other office applications.Experience with Microsoft based infrastructure, Domain Controllers, Active Directory, GPOsExperience with scripting and automation is an advantage, PowerShell and Bash.Excellent understanding of the OSI or TCP/IP model, roles of network devices and LAN/WAN.Good interpersonal and communication skills, both written and verbalAbility to grasp technical concepts quickly.Ability to work in a team environment and manage multiple tasks. Key Benefits: Competitive remuneration package based on skills and experience.Benefit Discount Card for various products and services.Monthly benefit toward gym membership or health insurance coverage after the probationary period.Complimentary tea, coffee, refreshments, fruits, and snacks in the office.Complimentary breakfast and lunch on specific days.Opportunity to build a successful career and experience professional growth within the firm.To apply for this vacancy, please send your CV, along with any covering letter to jobs@careerfinders.com.cy quoting the reference number ERG7102. Please note that due to the high volumes of applications received only shortlisted applicants will be responded to. To view our privacy policy, please click www.careerfinders.com.cy/privacy-policy.  "
227963,https://www.ergodotisi.com/en/JobDetails/227963/Cyprus-Marine-and-Maritime-Institute-(CMMI),Larnaca,Cyprus Marine and Maritime Institute (CMMI),Fulltime,not given,,"  R&D Hardware Engineer    Larnaca CY    Not available Computer Science, Electrical Engineers, Educational Researchers   Cyprus Marine and Maritime Institute (CMMI)   Join CMMI's Maritime Digitalisation Centre in Cyprus as an R&D Hardware Engineer. Seek expertise in circuit design & prototyping.   10/27/2023 12:00:00 AM 11/27/2023 12:00:00 AM     R&D Hardware Engineer new REF. NUM: 227963     Larnaca  posted 17 days ago     Cyprus Marine and Maritime Institute (CMMI)  expires in 14 days    438            CATEGORY: Computer Science, Electrical Engineers, Educational Researchers  PUBLISHED BY: Non-profit organisation   EMPLOYMENT TYPE: Fulltime INDUSTRY: Not available        The Cyprus Marine and Maritime Institute (CMMI) is inviting applications for the R&D Hardware Engineer position at CMMI’s Maritime Digitalisation Centre (MDigiC), located in Cyprus. This position aims to recruit a qualified individual, and only one successful applicant will be hired. The initial contract will be for one year, with the possibility of renewal based on performance and business needs.About Cyprus Marine and Maritime Institute:The Cyprus Marine and Maritime Institute (CMMI) is a research and innovation centre focused on marine and maritime sectors. Based in Larnaca, Cyprus, CMMI aims to drive sustainable Blue Growth and has ten specialised Research and Innovation Centres with funding from the EU’s Horizon 2020 program and the Cyprus Government.Candidate Profile:We are looking for a skilled Hardware Engineer to join our team. The ideal candidate should have a background in circuit design and analysis, with experience working with analogue and digital circuits and selecting electronic components. The candidate should have hands-on experience in prototyping hardware using breadboarding, soldering, and assembling electronic components. Strong troubleshooting and debugging skills are necessary to ensure on-time and quality delivery. Additionally, the candidate should have a good understanding of firmware development. Attention to detail, problem-solving abilities, and a passion for electronics are key attributes we are seeking. If you have a proven track record in electronics engineering and are eager to contribute to innovative projects, we encourage you to apply.Job Description:The successful candidate will be responsible for circuit design and analysis in analogue and digital domains. Moreover, the candidate will work closely with the team, utilizing circuit simulation software to ensure optimal design performance. Expertise in selecting electronic components will be crucial for creating innovative designs. Additionally, the candidate will be involved in prototyping hardware, including breadboarding, soldering, and assembling electronic components. Troubleshooting and debugging hardware designs will be part of the responsibilities. Furthermore, the candidate will have the opportunity to contribute to firmware development, enhancing the functionality of our electronic systems. Finally, the candidate should follow purchase and procurement procedures and manage the hardware stock.Qualifications:A Bachelor’s or a Master’s in a relevant field (e.g., Electrical Engineering, Computer Engineering).Experience in designing, building, and testing hardware prototypes.Excellent teamwork skills.It would be an advantage to have:Proficiency in using circuit simulation software and prototyping tools.Excellent project management skills.Knowledge of industry standards and best practices.Strong experience in firmware developmentKnowledge of public procurement proceduresBenefits:Competitive salary based on experience and qualifications13th SalaryPension PlanFlexible Working ArrangementsExtensive learning opportunitiesPurpose-driven organisationA culture of belonging, where everyone feels seen, heard, valued for who they are, and empowered to succeedHow to Apply:Applications will be evaluated immediately on a rolling basis. Only the most qualified candidates will be contacted for an interview, and the position will be filled as soon as a suitable candidate is found.To apply, please submit:A detailed curriculum vitaeCopies of degree certificatesOnly applications that meet the above criteria will be considered. All qualified applicants will receive consideration for employment without regard to race, colour, religion, sex (including sexual orientation and gender identity), national origin, or disability. All applications will be treated in strict confidence. For further information, please refer to our privacy notice in Privacy Notice Potential Employees.Only shortlisted candidates will be contacted.For further information, please contact us at +357 24506100 or via email at recruitment@cmmi.blue.  "
228846,https://www.ergodotisi.com/en/JobDetails/228846/QBeat-Technologies-LTD,"Famagusta, Larnaca, Nicosia",QBeat Technologies LTD,Fulltime,not given,,"  Software Engineer    Nicosia, Larnaca, Famagusta CY    Computer Science Computer Science   QBeat Technologies LTD   QBeat Technologies is looking to hire a Software Engineer to work on international software projects.   11/6/2023 12:00:00 AM 12/6/2023 12:00:00 AM     Software Engineer new REF. NUM: 228846     Nicosia, Larnaca, Famagusta  posted 7 days ago     QBeat Technologies LTD  expires in 23 days    290            CATEGORY: Computer Science  PUBLISHED BY: Private Company (LTD)   EMPLOYMENT TYPE: Fulltime INDUSTRY: Computer Science        About the Opportunity Be part of something exciting! QBeat Technologies, based in scenic Larnaca, is on the hunt for a dynamic Software Developer in Java or C#. Choose your ideal work setup—hybrid or on-site—and collaborate with our top-tier clients across Dubai, Gibraltar, Luxembourg, Spain, and Cyprus. Come innovate with us!RequirementsProficient in Java or C#, and familiar with essential frameworks such as Spring for Java and ASP.NET Core for C#.Hands-on experience with ORMs such as Hibernate or EF Core.SQL wizardry.Version control skills (Git).Fluent in Object-Oriented Programming.Good understanding of concurrency and multithreadingExcellent English communication.Excellent teamwork and collaboration skills.Team-player attitude with the ability to meet tight deadlines.Strong sense of ownership - Own your projects and see them through.You are self-directed and able to craft new software under minimal supervision.Bonus PointsComputer Science degree? Awesome!Forex/Fintech experience? You’re ahead of the game.Docker and Kubernetes know-how.Cloud know-how (GCP, AWS, Azure).Good understanding of Front-End Development and experience with modern web frameworks (e.g. React)Linux and bash familiarity.Speak Greek? Even better!Your Role & ResponsibilitiesDesign, build, and launch top-quality software.Tackle both new projects and support existing ones.Develop PoCs to validate solutions.Interface with business leaders to define and solve challenges.Elevate code quality through reviews.Solve software glitches effectively.Promote a transparent, teamwork-based culture.Share your tech wisdom with the team.Write technical documentation and contribute to our wikiWhat's In It For You?A competitive salary based on your skills and experience.Endless opportunities for personal growth.Complimentary Pluralsight account.A stocked library filled with Software Development must-reads.Flexibility with a hybrid work option post-training.Regular company socials Are you interested?Please send your CV to careers@qbeat.io Our Interview ProcessCV & Portfolio Review: We closely evaluate your resume and public portfolios.Technical Interview: Includes a hands-on coding test and technical discussion.Culture Fit Interview: Let's make sure we're the perfect match for each other.Note: Only candidates who successfully pass each round will be contacted for the next steps.Why Choose QBeat?Quality First: We take immense pride in delivering top-notch solutions.Client-Centric: Our ears are always open to our clients' needs.Agile and Adaptive: We are agile and stay flexible and effective.Work-Life Harmony: Hard work is important, but so is a balanced life.Note: Only successful candidates will be contacted for interviews.  "
