ID,URL,Location,Company,Employment Type,Years of Exp,Education Level,Data
226340,https://www.ergodotisi.com/en/JobDetails/226340/Playtech-BGT-Sports-Ltd,Nicosia,Playtech BGT Sports Ltd,Fulltime,2,,"  Software Developer (Python)    Nicosia CY    Computer Science Computer Science   Playtech BGT Sports Ltd   Playtech BGT Sports Ltd. seeks to recruit a Software Developer (Python) in Nicosia.   10/13/2023 12:00:00 AM 11/13/2023 12:00:00 AM     Software Developer (Python) new REF. NUM: 226340     Nicosia  posted 31 days ago     Playtech BGT Sports Ltd  expires today    282            CATEGORY: Computer Science  PUBLISHED BY: Private Company (LTD)   EMPLOYMENT TYPE: Fulltime INDUSTRY: Computer Science        Company Description: Founded in 1999 and premium listed on the Main Market of the London Stock Exchange, Playtech is a technology leader in the gambling industry with over 7,000 employees across 20 countries. Playtech is the gambling industry's leading technology company delivering business intelligence driven gambling software, services, content and platform technology across the industry's most popular product verticals, including, casino, live casino, sports betting, virtual sports, bingo and poker.  Playtech Sports is a subsidiary of Playtech. Playtech Sports builds mobile and desktop applications for sports betting operators and has a proud history and a proven track record with the biggest players in the business. Our GenBet product provides operators with a robust and secure central customer management platform onto which any number of products can be added and managed. Sportsbook, Lottery, Pool Betting and Fixed-Odds Games modules allow the operator to tailor their online service whilst a comprehensive back office and reporting suite provides powerful tools for event and market management. We understand the importance of a good work-life balance and offer flexible work hours and the option to work while commuting or from home when needed. We take our culture seriously and make time for fun, health and charity with a dedicated playroom, frequent social activities and charity events. Playtech Sports has offices in Malmo, London, Vienna, Bremen, Sofia, Nicosia and Kyiv with 600+ employees. This is an opportunity for you to join a fun and supportive, fast-paced team, with an emphasis and enthusiasm for technology! Job Description: As a Software Developer (Python), you will become part of a diverse, highly technical development team, where everyone's input is valued.  Our main focus is on solving complex, data-heavy problems in the most efficient way possible. Our office of Software Engineers & Testers operates within a highly collaborative environment and we like to play each person to their strengths, ensuring they are always working within a team that will not only challenge them but ultimately prove fulfilling. Technically, we use many Open Source technologies, keeping our tech stack cutting-edge where possible. Your role as a Software Engineer will be to create and maintain applications within our microservice architecture using a mix of Python, Docker, Kubernetes, Oracle SQL, MongoDB, Kafka and RabbitMQ. Experience in these specific technologies is highly desirable and it is essential to have experience in Linux environments and databases and a confidence in general programming paradigms. Your Role: Development of our Sportsbook product and applications.Implementing new features and maintaining production code.Designing innovative solutions to complex problems.Contributing meaningful peer code reviews.Implementing unit tests.Working in an agile development process. Qualifications: Previous professional experience using any modern programming language (preferably Python), at least 2 years.Linux / Unix experience.Solid experience with relational databases.Interest in Python and Open Source technologies.Ability to learn on the job and show an aptitude for solving complex technical problems.Desirable Skills & Experience: Experience within a highly technical environment, solving complex problems.Experience in using Micro Services, RESTful APIs, message brokers (e.g. RabbitMQ) and NoSQL datastores (e.g. MongoDB).Experience with Docker, and Kubernetes.Experience in developing applications using non-blocking IO (event loops).Experience with Python, Tornado or asyncio.Good understanding of client-server architecture and web protocols.Previous commercial experience in the Gambling or Sports Betting sector.An outside interest in programming reflected by a blog/portfolio, GitHub, Bit Bucket profile or personal website.Our unique attributes: An excellent remuneration package (including attractive salary, 13th salary, Medical insurance, educational leave and many more).Travelling expenses package offered.We have a professional and motivated team.We offer multiple ways to develop yourself.We have a work culture that allows flexibility and hybrid working status.We have an office where you actually want to work.We cherish a diverse work environment.We organize company events for all tastes.If you are excited by the challenge and fast-paced work, please click here: Software Developer (Python)  All applications will be treated with the strictest confidentiality. Playtech is an Equal Opportunity Employer hence all qualified applicants will receive consideration for employment without regard to race, color, national origin, religion, sexual orientation, gender, gender identity, age, or physical disability.  "
226974,https://www.ergodotisi.com/en/JobDetails/226974/3CX-Ltd,Nicosia,3CX Ltd,Fulltime,5,,"  Senior Network Operations Engineer    Nicosia CY    Telecommunication / Internet Computer Science   3CX Ltd   3CX has an opportunity for a Senior Network Operations Engineer. If these words excite you - ‘install, configure, monitor, firewalls, switches, routers, networ   10/18/2023 12:00:00 AM 11/18/2023 12:00:00 AM     Senior Network Operations Engineer new REF. NUM: 226974     Nicosia  posted 26 days ago     3CX Ltd  expires in 5 days    942            CATEGORY: Computer Science  PUBLISHED BY: Private Company (LTD)   EMPLOYMENT TYPE: Fulltime INDUSTRY: Telecommunication / Internet        3CX has an opportunity for a Senior Network Operations Engineer. If these words excite you -  ‘install, configure, monitor, firewalls, switches, routers, network security’ - read on! Your ExperienceEnterprise network administration and architectureTCP/IP layers, switching and routingAccess controls and network security (Zero Trust model)Firewalls & VPNWindows/Linux environmentActive Directory, DNS, DHCPESXI and VirtualizationTechnical assistance training Technology best practices, guidelines and repeatable processesGood to HaveKnowledge of network security testingExperience with cloud technologies/vendorsAbout YouCan you say yes to the five things listed below?5 years + experience as a Network Operations Engineer/AdministratorBusiness level EnglishPractical knowledge and experience of maintaining a networkExperience managing 1 or 2 network engineers / junior ITExperienced enough to work effectively with minimal direction.What You Will DoInstall, configure, and monitor network devices (switches, routers, firewalls)Maintain/update inventory of software patches to address vulnerabilitiesMonitor security events and identifying potential security risksMonitor necessary controls to strengthen internal network and published endpointsPerform network security testingMaintain ESXI servers as well as Domain ControllersTroubleshoot and resolve any network related issues Maintain complete technical documentationWork in a challenging technical environmentWhere Will You Be BasedWe have an amazing office in Nicosia, Cyprus. You'll be part of a vibrant team enjoying the many benefits the Company offers, including an international work environment, catering, private gym and swimming pool, performance related bonus, and an annual profit share scheme.To Apply3CX invites you to apply via our website and to include a covering letter illustrating why you're the right person for the job. If selected, you'll be invited to participate in 2 interviews to assess your communication skills and technical abilities. Due to the very large number of applications we receive, we will only contact those who reach the next stage of our selection process.  "
226489,https://www.ergodotisi.com/en/JobDetails/226489/NCR-Corporation,Nicosia,NCR Corporation,Fulltime,6,,"  Senior Software Engineer    Nicosia CY    Technology Computer Science, Mechanical Engineers   NCR Corporation   Develop high quality software solutions as a contributing member of a highly skilled and motivated team of Software Engineers and Consultants.   10/16/2023 12:00:00 AM 11/16/2023 12:00:00 AM     Senior Software Engineer new REF. NUM: 226489     Nicosia  posted 28 days ago     NCR Corporation  expires in 3 days    817            CATEGORY: Computer Science, Mechanical Engineers  PUBLISHED BY: Private Company (LTD)   EMPLOYMENT TYPE: Fulltime INDUSTRY: Technology        About NCRNCR Corporation (NYSE: NCR) is a leader in transforming, connecting and running technology platforms for self-directed banking, stores and restaurants. NCR is headquartered in Atlanta, Ga., with 38,000 employees globally. NCR is a trademark of NCR Corporation in the United States and other countries.About NCR CorporationNCR Corporation (NYSE: NCR) is a global technology company leading how the world connects, interacts and transacts with business. NCR’s assisted- and self-service solutions and comprehensive support services address the needs of retail, financial, travel, hospitality, gaming, public sector, telecom carrier and equipment organizations in more than 100 countries. NCR (www.ncr.com) is headquartered in Duluth, Georgia.Position Summary & Key Areas of ResponsibilityPrimary responsibility is to develop high quality software solutions as a contributing member of a highly skilled and motivated team of Software Engineers and Consultants. This individual will integrate the Global Professional Services group and will be part of an Agile team working on software development and deployment projects globally.Responsibilities include:Develop high quality software which meets requirements, promote re-use of software components and facilitates ease of supportDiagnose, isolate, and implement remedies for system failures caused by errors in software codeFollow a prescribed software development process based on ScrumIdentify and implements process improvementsUtilize software-based system maintenance and tracking toolsConduct unit tests, track problems, and implement changes to ensure adherence to test plan and functional/non-functional requirementsAnalyse, design and implement software mechanisms to improve code stability, performance, and reusability. Participate and lead code review sessionsCreate good estimates of their own work efforts and assist others in estimating task effort and dependencies. Be co-responsible for team commitments within the SprintApply good debugging and troubleshoot techniques to understand and resolve defects found in softwareStay current with technology, disseminate knowledge to team members, form best practicesCreate high quality documentation as required like functional specifications; unit test specificationsProvide input and technical content for technical documentation, user help materials and customer trainingWhen required, travel to customer sites (usually for no longer than one week at a time) and work with customers on project related activitiesThe Ideal Candidate will:Have excellent communication skills (English is essential)Have excellent teamwork and collaboration skillsHave mentorship skills to actively listen, provide constructive feedback and offer guidance to other team membersHave good understanding of design patterns and system designBe a self-starter, able to use his/her own initiative to get things doneBe reliable, enthusiastic and have a ‘can-do’ attitude towards achieving the team’s objectivesBe passionate about technology and how it can be used to “make the everyday easier”Basic Qualifications:Bachelor’s Degree in Computer Science, Engineering or related fieldAt least 6 years of professional experience in software design and developmentExperience with web applications development including client and server-side technologiesGood understanding of Software Development and Quality Assurance best practicesExcellent written and verbal communication skillsAvailability to travel (up to 10% of the time, usually for short durations)Preferred Qualifications:Experience with Python, .NET Core (C#) or similar programming languagesExperience with Angular (TypeScript), React or similar front-end frameworksExperience with RESTful API services: understanding, consuming and implementingExperience with Unix/Linux environments and scriptingExperience with Secure Software Development Lifecycle processUnderstanding of Unit Testing and experience with frameworks for their implementationExperience with the development of mission-critical, event-driven, fault-tolerant software applicationsExperience with tools like GitHub, Jenkins, Jira, SonarQube or othersExperience operating in an Agile development environment and familiarity with Scrum methodologiesVisit our careers site for a list of the benefits offered in your region in addition to a competitive base salary and strong work/family programs.EEO StatementIntegrated into our shared values is NCR's commitment to diversity. NCR is committed to being a globally inclusive company where all people are treated fairly, recognized for their individuality, promoted based on performance and encouraged to strive to reach their full potential. We believe in understanding and respecting differences among all people. This concept encompasses but is not limited to human differences with regard to race, ethnicity, religion, gender, culture and physical ability. Every individual at NCR has an ongoing responsibility to respect and support a globally diverse environment.If you are interested please send your CV to Josephine.frangiskou@ncratleos.com or please apply via https://ncr.dejobs.org/nicosia-cyp/senior-software-engineer/C4578DA20EB64829B912ADD108AB05ED/job/   "
227401,https://www.ergodotisi.com/en/JobDetails/227401/iSX-Financial-EU-Plc,Nicosia,iSX Financial EU Plc,Fulltime,3,BA,"  Senior DevOps Engineer    Nicosia CY    Banks / Financial Institutions Computer Science   iSX Financial EU Plc   We are currently looking for a Senior DevOps Engineer to join our team in Nicosia.   10/23/2023 12:00:00 AM 11/23/2023 12:00:00 AM     Senior DevOps Engineer new REF. NUM: 227401     Nicosia  posted 21 days ago     iSX Financial EU Plc  expires in 10 days    215            CATEGORY: Computer Science  PUBLISHED BY: Public Company (PLC)   EMPLOYMENT TYPE: Fulltime INDUSTRY: Banks / Financial Institutions        Who we are? ISX Financial EU Plc is an authorised Electronic Money Institution licensed by the Central Bank of Cyprus. The company provides payments, issuance of electronic money, IBAN addressable stored value accounts and KYC identity verification services to eCommerce merchants, regulated sector businesses and consumers.  ISX Financial EU Plc also operates a sophisticated & patented anti-money laundering and anti-fraud system that also provides transactional security to business and retail customers. It is real time and detects the AML issues currently in focus by regulators.  ISX Financial EU Plc is part of the ISX Financial Group of companies. Our inhouse developed platforms allow us to deliver technology and financial services to our customers. The Group employs more than 140 staff located across our offices located in Australia, Cyprus, Lithuania, United Kingdom, Netherlands, USA, Israel, Malta. The role: As a Senior DevOps Engineer in iSX Financial, you'll be working with the international ISX team, our customers, banks, financial institutions, payment service providers, and identity service providers to build innovative solutions like Probanx, Paydentity, CoreConnect, and Flykk eMoney Responsibilities include (but are not limited to): Design & Deliver solutions to our customers.Work with the business, and broader technology team to agree software specifications and standards.Manage the entire infrastructure lifecycle for our services.Improve and maintain automation and CI/CD for the development process.Understanding team workflow processes and analyzing opportunities for improvement.Document procedures and protocols.Lead cloud migration projects.Automate processes. Run a high-quality service: Maintain a minimum of 99.5% uptime with automation, tools, and processes.Manage the cost of providing new and existing services.Participate in incident responses and remediation.Security and Compliance are key to what we do: Develop and implement software and services that meet international standards like ISO 27001/PCI DSS, and local/scheme requirements.Working closely with the Security/Compliance teams (Security & Privacy)Improve our compliance and security processes and frameworks (SSDLC) Skills and Requirements:  3+ years of Hands-on experience in at least one major public cloud platform (preferably AWS/Azure)3+ years of experience with IaC such a Terraform (preferred). Experience with Kubernetes (K8s).Experience with Python/ PowerShell / Linux shell scripting (bash) and automation.Experience implementing CI/CD for code and infrastructure with Git, Docker, and Jenkins pipeline. Understanding of TCP/IP Networking, routing, and VPN technologies. Experienced with enterprise-level networks including basic protocols, routing, and switchingHigh level of problem-solving skills and debugging of high-complexity systemsTeam player Desirable Experience:  Payments (cards, ACH, CHIPS, Fedwire, SWIFT), core banking, risk, or other fintech experience. Operating in a SaaS model in a 24x7 environment. Designing and delivering high availability systems built on AWS. Implementing security in Public Cloud Infrastructure & public facing APIs AWS services: Elastic Kubernetes Service, Amazon Managed Streaming for Apache Kafka (Amazon MSK), Lambda and API gateway. Deploying, operating, and diagnosing software written in Java (Spring Boot), C# (.NET framework or .NET core), iOS mobile applications, REST, and React. Work with database: PostgreSQL, MongoDB, Redis, ActiveMQ, or Kafka. Exposure to any of PagerDuty, CloudWatch, ElasticSearch/Logstash/Kibana, and Prometheus/GrafanaEngineering or Computer Science Degree or Advanced CertificatesThe Package: Attractive remuneration packagePrivate Medical InsuranceEmployee Referral bonusInternal cafeteria with barista, unlimited snacks, fruits, drinksSports Benefit participation schemeBirthday leavePerformance Bonus, including mix of cash and share-based scheme of company stock for outstanding performers.How to Apply: Apply to careers@isxfinancial.com  with a full copy of your CV quoting “Senior DevOps Engineer”. Right to Work: You must have the right to legally reside and work in the Republic of Cyprus or be an EU citizen.   "
228268,"https://www.ergodotisi.com/en/JobDetails/228268/TSYS,-A-Global-Payments-company",Nicosia,"TSYS, A Global Payments company",Fulltime,1,"BSc, MSc, MCA, BCA, B Tech","  DevOps Engineer     Nicosia CY    Not available Computer Science   TSYS, A Global Payments company   An opportunity has arisen for a DevOps Engineer to join our TSPRIME DevOps team in Nicosia.   10/30/2023 12:00:00 AM 11/30/2023 12:00:00 AM     DevOps Engineer  new REF. NUM: 228268     Nicosia  posted 14 days ago     TSYS, A Global Payments company  expires in 17 days    291            CATEGORY: Computer Science  PUBLISHED BY: Private Company (LTD)   EMPLOYMENT TYPE: Fulltime INDUSTRY: Not available        DevOps Engineer Be part of our international team, apply today and join our award-winning Fortune 500® company!An opportunity has arisen for a DevOps Engineer to join our TSPRIME DevOps team in Nicosia. Working with our distributed team, the successful candidate will have a part in efforts to build, support and improve our tools for CI/CD/CT and release management throughout the complete software development cycle. The successful candidate will be involved in continuous improvements on our existing tools and build pipelines with focus on AWS.The DevOps Engineer will play a role in taking the current state and tools to the next step by automating as much as possible from the existing processes.Essential requirements for the role:1+ year in application development role1+ year in DevOps roleAbility to debug complicated script sequencesHands on experience with the following:GIT (either Bitbucket or GitHub)Jenkins pipelinesBuilding & using Docker imagesShell scripting (Bash and/or PowerShell)Linux cli.Desired requirements for the role: 2+ years in DevOps – BitBucket GIT / AWS EC2 / JenkinsExperience in TSYS PRIME/TSPRIME systemsKnowledge of AWS platformAbility to analyse situations or data that requires a review of a variety of factorsGood judgement to determine appropriate action within defined procedures and practices Aptitude for building productive internal/external working relationshipsAbility to create solutions for managing and monitoring containerized workloads and AWS services.The successful candidate should also have the following experience and skills:Educated to degree level (e.g. BSc, MSc, MCA, BCA, B Tech) in an IT related subject such as Computer Science or MISGood communication skills - ability to communicate clearly and concisely in English language, both verbally and in writing, and to interact with both Business and IT partners to define, understand and evaluate business requirements and resolve production issuesAbility to work competently, accurately and professionally in a changeable & time critical environment and ultimately meet deadlinesSuperior analytical and problem-solving skills - ability to gather and analyse information and draw logical conclusions while identifying the root cause of problems and providing options for resolution. Detail oriented individual. Easily motivated with a solid work ethicDiagnose, troubleshoot and provide technical support on system and related technology issuesActively contribute with ideas and suggestions to improve both technical knowledge base and organizational processes.TSYS offers structured career development, supported by training that provides the opportunity to learn and develop.In addition to a competitive salary, you’ll have access to an excellent benefits package, including:Private medical insurance for you and your family, non-contributory, in and out patient coverA well-established, strong provident fundLife insurance (3x base salary)21.5 days’ holiday, plus 14 public / bank holidaysFlexible working (hybrid model – part from home, part from office)Wellbeing initiatives with access to support servicesOn-site subsidized canteen & baristaModern offices opposite the Mall of Cyprus with gym and showers, games room (pool table, table tennis, darts, table football, play station) & prayer/meditation roomStore discountsRegular social events and charitable initiatives to give back to our community.To apply for this position, please visit our website www.globalpayments.com/about-us/careers and apply through the online system. All applications will be treated in the strictest confidence.  "
