ID,URL,Location,Company,Employment Type,Years of Exp,Education Level,Data
228356,https://www.ergodotisi.com/en/JobDetails/228356/Tototheo-Maritime-Ltd,Limassol,Tototheo Maritime Ltd,Fulltime,not given,,"  Network Support Officer    Limassol CY    Shipping companies Computer Science   Tototheo Maritime Ltd   We are seeking to hire a Network Support Officer.   10/31/2023 12:00:00 AM 11/30/2023 12:00:00 AM     Network Support Officer new REF. NUM: 228356     Limassol  posted 13 days ago     Tototheo Maritime Ltd  expires in 17 days    211            CATEGORY: Computer Science  PUBLISHED BY: Private Company (LTD)   EMPLOYMENT TYPE: Fulltime INDUSTRY: Shipping companies        Job Purpose:The Network Support Officer is responsible to monitor and maintain a wide variety of products and solutions within the Maritime Satellite Communications Industry. Tasks include, diagnosing software/hardware and technical problems, configuring different systems to suit customer’s requirements and being as efficient as possible in his/her resolution time.The main job purpose of the Network Support Officer is to provide technical and network problem resolution to the end user (customers) by performing a question diagnosis while guiding users through step-by-step solutions. When necessary, the Network Support Officer will follow specific procedures to escalate technical problems to the System Engineer.This is a critical and an important role to the company, because the Network Support Officer represents the organization and is the direct point of contact for our customers, during critical moments.Main Duties and Responsibilities:Research and identify solutions when software and hardware issued occur.Diagnose and troubleshoot technical issues, including account setup and network configuration relating to Tototheo products.Ask customers targeted questions to quickly understand the root of the problem.Track issues through to resolution, within agreed time limits.Guide the end user through a series of actions, either via phone or email, until they’ve solved a technical issue.Properly escalate unresolved issues to the System Engineer.Provide prompt and accurate feedback to the customer.Refer to internal database or external resources to provide accurate tech solutions.Prioritize and manage several open issues at one time.Follow up with clients to ensure proper functionality of services and solutions provided.Maintain and develop a solid professional relation with existing and new clients.24/7/365 shift work to provide technical support upon request from the customer at any time (shift patterns between colleagues will take place).Qualifications:A Degree in Computer Science, Computer Network Administration, Information Systems Management or adequate experience in a similar position.Networking & Knowledge of services and protocols such as DNS, HTTP, SMTP, STP, SNMP, DHCP.Some exposure to Linux (Debian).Working experience with security appliances, primarily FortiNet devices.Base understanding of Cyber Security concepts.Knowledge of setting up wireless networks and Access Points.Excellent knowledge of the English Language.Good communication skills (written and oral).Excellent problem-solving skills.Flexibility and adaptability to juggle a range of different tasks and to work extra hours to meet deadlines.The ability to work under pressure and to tight deadlines.Ability to work collaboratively across departmental functions.The ability to assess and modify your own approach when speaking to customers.The ability to deal with difficult calls whereby the caller may not have English as a first language.The ability to provide good analysis, sometimes at a short notice, due to the urgency of each requirement from the customers.Experience with monitoring solutions and procedures.Ability to provide step-by-step technical help, both written and verbal.Apply here: https://tototheo.bamboohr.com/careers/127   "
228263,https://www.ergodotisi.com/en/JobDetails/228263/Tototheo-Maritime-Ltd,Limassol,Tototheo Maritime Ltd,Fulltime,not given,,"  VSAT Technical Engineer    Limassol CY    Shipping companies Shipping, Computer Science, Mechanical Engineers, Electrical Engineers, Technicians   Tototheo Maritime Ltd   The VSAT Technical Engineer will install, service, and repair Satellite Communication equipment on board ships in Cyprus and abroad.   10/30/2023 12:00:00 AM 11/30/2023 12:00:00 AM     VSAT Technical Engineer new REF. NUM: 228263     Limassol  posted 14 days ago     Tototheo Maritime Ltd  expires in 17 days    338            CATEGORY: Shipping, Computer Science, Mechanical Engineers, Electrical Engineers, Technicians  PUBLISHED BY: Private Company (LTD)   EMPLOYMENT TYPE: Fulltime INDUSTRY: Shipping companies        Job PurposeThe VSAT Technical Engineer will install, service, and repair Satellite Communication equipment on board ships in Cyprus and abroad. He/She will also provide remote support to vessels, and internally to the Sales, Service Coordination and Satcom support teams with regards to VSAT and FX installations.Main Duties and Responsibilities:Travel to various locations worldwide for installation of company’s Satcom solutionsInstall, test, configure, repair of VSAT and Fleet Broadband systems or other solutions involving these technologiesLoad, update, and modify softwareMake intelligent use of complex schematics, blueprints, and manuals to accurately achieve assignmentsCreating schematics and other supporting documents for company’s solutionsCreate manuals or guides for other technicians, support teams or customersCreating a detailed service report upon completing assignmentsDocument technical knowledge in the form of notes and manualsSatcom hardware testing for integration with company’s solutionsBe part of a technical and development team whose sole purpose is to optimize company’s solutions. This includes, testing of hardware, software APIs, various configurations, and continuous collaboration on various levels to ensure best customer satisfactionMaintain and develop a solid professional relation with existing and new clientsMaintain in depth knowledge of company’s products and servicesMaintain good communication and cooperate well with other departmentsGood knowledge of the company’s electronic systems and databasesHandle after office hours requests from the customersProvide remote support to customer/user support requests and provide assistance in troubleshooting issues relating to our products including the integration thereof into a variety of VSAT systems as well as IT networksExplain and assist vessel crew on how and where to install equipment (antennas, rack and cables-gyro)Follow up with them and confirm that everything is installed correctly (photos)Check the pre-installation checklist and confirm that vessel is ready for commissioningRemotely assist the technician during the installation, if neededIf the commissioning is not completed or the crew finds an issue, assist to resolve or on how to resolve it (spare parts needed and if attendance is required)Smartbox (installation & configuration) as we install it during the commissioningQualifications:A University degree in Electronics, Engineering, Computer Science or equivalent technical certificatesAdequate experience in a similar positionKnowledge of satellite communications principlesOperational knowledge of iDirect and/or Comtech VSAT technology – (X7/Velocity an advantage)Knowledge of TDMA (DVBS-2 an advantage)Understand Link Budget requirementsGood knowledge of LAN/WAN internetworking and components (Firewalls, Switches & Routers)Experience in the installation and operation of VSATs, including antenna pointing, use of spectrum analyzer and understanding of RF communicationsExcellent knowledge of the English LanguageGood communication skills (written and oral)Strong knowledge of electronics theory and applicationWillingness to travel often and on occasion to remote locationsAbility to read and create schematics, diagrams, user manuals, technical manuals etc. (knowledge of MS Visio is considered an advantage)Good knowledge of MS OfficeComputer literacyLogical thinker and the ability to work aloneFlexibility and adaptability to manage a range of different tasks and to work extra hours to meet deadlinesGood organizational and time management skillsPrioritization skillsExcellent problem-solving skillsTeam player mentalityAdaptability to changing situationsA keen eye for detail and a result driven approachCustomer service orientation Apply here: https://tototheo.bamboohr.com/careers/131   "
228188,https://www.ergodotisi.com/en/JobDetails/228188/CareerFinders-Recruitment-Services-Ltd,Limassol,CareerFinders Recruitment Services Ltd ,Fulltime,3,,"  Back-End Software Engineer (Java) (Hybrid - 7087)    Limassol CY    Computer Science Computer Science   CareerFinders Recruitment Services Ltd    CareerFinders, on behalf of our client, a Software Development company with offices in Limassol, we are seeking a Back-End Software Engineer.   10/30/2023 12:00:00 AM 11/30/2023 12:00:00 AM     Back-End Software Engineer (Java) (Hybrid - 7087) new REF. NUM: 228188     Limassol  posted 14 days ago     CareerFinders Recruitment Services Ltd   expires in 17 days    168            CATEGORY: Computer Science  PUBLISHED BY: Private Company (LTD)   EMPLOYMENT TYPE: Fulltime INDUSTRY: Computer Science        CareerFinders, on behalf of our client, an expanding Software Development company with offices in Limassol, we are seeking to recruit a Back-End Software Engineer to join their growing team. The successful applicant will work as part of a talented team of software development professionals tasked with writing excellent well-tested code, developing software at scale, and deploying to cloud environments. You will ideally be educated to degree level in Computer Science or a related field and will need to possess proven experience writing objected-oriented code in Java using the Spring/Spring Boot framework. Key Duties/Responsibilities: Participate and contribute to design and code reviews to produce quality code.Conduct thorough testing of feature functionalities.Manage small projects.Work efficiently with peers to solve complex problems, as well as raising appropriate issues to the team-lead. Key Skills/Experience: Ideally educated to degree level in Computer Science or a related field.Demonstrable experience (1-3 years) writing objected-oriented code in Java using the Spring/Spring Boot framework (Kotlin is a plus).Experience in building a backend service with Spring and deploying to production.Your code is well-structured and readable, fits into existing frameworks, adheres to best design patterns, and has good exception handling.You are able to test code appropriately (UnitTest with Mockito, familiar with concept of integration tests and Spring Boot Tests).You are able to identify and analyse issues in design/code, and are starting to debug others’ code.Strong communicator, highly dependable and enjoy working within a diverse team.Previous experience working in an agile team with use of Jira or other similar issue tracking products is highly desirable. Key Benefits: A competitive salary with regular pay reviews and bonuses.Healthy tech budget to make sure you’ve got your perfect work set-up.Generous personal development budget and dedicated company-wide hack days focused on employee growth.Flexible work environment and hours, we care that you get the job done not when and where (start and finish almost when you want).Hybrid-remote work model.To apply for this vacancy, please send your CV, along with any covering letter to jobs@careerfinders.com.cy quoting the reference number ERG7087. Please note that due to the high volumes of applications received only shortlisted applicants will be responded to. To view our privacy policy, please click www.careerfinders.com.cy/privacy-policy.   "
228386,https://www.ergodotisi.com/en/JobDetails/228386/iSX-Financial-EU-Plc,Nicosia,iSX Financial EU Plc,Fulltime,3,"BSc, BA, MSc","  QA Automation Engineer    Nicosia CY    Banks / Financial Institutions Computer Science   iSX Financial EU Plc   We are currently looking for a QA Automation Engineer to join our team in Nicosia.   10/31/2023 12:00:00 AM 11/30/2023 12:00:00 AM     QA Automation Engineer new REF. NUM: 228386     Nicosia  posted 13 days ago     iSX Financial EU Plc  expires in 17 days    230            CATEGORY: Computer Science  PUBLISHED BY: Public Company (PLC)   EMPLOYMENT TYPE: Fulltime INDUSTRY: Banks / Financial Institutions        Who we are: ISX Financial EU Plc is an authorized Electronic Money Institution licensed by the Central Bank of Cyprus. The company provides payments, issuance of electronic money, IBAN addressable stored value accounts and KYC identity verification services to eCommerce merchants, regulated sector businesses and consumers.  ISX Financial EU Plc also operates a sophisticated & patented anti-money laundering and anti-fraud system that also provides transactional security to business and retail customers. It is real time and detects the AML issues currently in focus by regulators.   ISX Financial EU Plc is part of the ISX Financial Group of companies. Our inhouse developed platforms allow us to deliver technology and financial services to our customers. The Group employs more than 140 staff located across our offices located in Australia, Cyprus, Lithuania, United Kingdom, Netherlands, USA, Israel, Malta.  Responsibilities include (but are not limited to): Creating and maintaining automated tests.Deploy and support test environment.Ensure that products meet the organization’s and customer’s quality and product integrity requirements.Estimate, prioritize, plan and coordinate testing activities.Identify, record, document thoroughly and track bugs.Identify root causes of problems in the production process; recommend and/or implement corrective measures.Analyze data to identify trends in product quality or defects with a goal of mitigating and preventing recurrence and future defects.Stay up to date with new testing tools and test strategies.Ability to learn and gain domain knowledge on the job.  Skills and Requirements: BSc/MSc Degree in Computer Science, Engineering, or related field3 years of proven work experience in Quality AssuranceExperience in automating testing Web and Mobile applicationBe aware of: Selenium framework, API Automation (Python requests), Appium, Pytest BDDProficiency in Python for test automationUnderstanding of CI/CD tools and systemsStrong background in QA and testing practices – test case design based on functional and non-functional requirements, test automation, continuous integration/continuous deployment, and defect analysis.Strong sense of ownership and accountability with a commitment to delivering high-quality software that balances technical and business goals.Strong analytical, technical, and problem-solving skills.Highly motivated and detail-oriented individual.  The Package: Attractive remuneration package.Private Medical Insurance.Employee Referral bonus.Internal cafeteria with barista, unlimited snacks, fruits and drinks.Sports Benefit participation scheme.Birthday leave.Competitive Salary.Performance Bonus, including mix of cash and share-based scheme of company stock for outstanding performers.21 days of Annual Leave (reaching up to 30 days per year based on years’ service). How to Apply: Apply to careers@isxfinancial.com with a full copy of your CV quoting “QA Automation Engineer”.  Furthermore, samples of your portfolio will be highly appreciated.  "
228131,https://www.ergodotisi.com/en/JobDetails/228131/TalosCo-Business-Solutions-Ltd,Nicosia,TalosCo Business Solutions Ltd,Fulltime,2,,"  Junior Software Engineer    Nicosia CY    Computer Science Computer Science   TalosCo Business Solutions Ltd   The candidate will be responsible to design, develop, test and support projects in Microsoft Dynamics NAV/Business Central and related technologies.   10/30/2023 12:00:00 AM 11/30/2023 12:00:00 AM     Junior Software Engineer new REF. NUM: 228131     Nicosia  posted 14 days ago     TalosCo Business Solutions Ltd  expires in 17 days    224            CATEGORY: Computer Science  PUBLISHED BY: Private Company (LTD)   EMPLOYMENT TYPE: Fulltime INDUSTRY: Computer Science        The successful candidate will work alongside a Business Implementation Consultant under the supervision of a Senior Applications Specialist. The candidate will be responsible to design, develop, test and support projects in Microsoft Dynamics NAV/Business Central and related technologies.Duties & Responsibilities Extend Microsoft Dynamics Business Central platform using existing Business Central SDK and .Net Framework.Integrate Microsoft Dynamics Business Central with other systems and applications.Perform unit testing, integration testing prior to deploying into production.Ensure solutions meet business needs and requirementsInstalls/Deploys Development(extensions), Pre-production, and Production Environments as neededLearns, adjusts and excels in the technology/tools selected for the implementation of the project.""Raises a flag"" on all not normal events, such as over-effort, inconsistencies, improvements, problems during Project Delivery.Ensures utilization and improvement of standards, processes, and tools with other colleagues in same profession.Good understanding of Business SoftwareSkills & Qualifications University Degree in Computer Science / Software Engineering.>2 years + working experience in IT solutions development.Knowledge of Microsoft Dynamics NAV/Business Central will be considered an advantageLanguage proficiency in Greek and EnglishTechnical Certification will be considered an advantageCommitment to deliver best-of-class quality and on-time projects.Passion to continuously learn in a fast-paced and challenging technology area.Good analytical and problem-solving skillsExcellent organization and communication skillsVery good documentation skillsVery good planning, organizational, and time management skillsTechnologies Excellent knowledge of Object-Oriented Development and Internet Technologies.Good knowledge of .NETBasic knowledge of HTML/CSS/JavaScript.Good understanding of HTTP APIs (REST/JSON and/or SOAP/XML)Good understanding of SQL and relational databases (Preferably MS SQL)Good understanding with unit testing frameworks.Experience in Report Designer (MS, Crystal)What do we offer: A competitive remuneration package will be offered to the successful candidate according to qualifications and experience.13th salaryProfessional team and friendly environment.Continuous personal development and internal training and opportunities.Please send your CV at info@talosco.com   "
227798,https://www.ergodotisi.com/en/JobDetails/227798/DW-Dynamic-Works-Ltd,Nicosia,DW Dynamic Works Ltd,Fulltime,not given,,"  Quality Assurance Engineer    Nicosia CY    Computer Science Computer Science   DW Dynamic Works Ltd   The Quality Assurance Engineer will be responsible for identifying, reporting and eliminating defects for our products.   10/25/2023 12:00:00 AM 11/25/2023 12:00:00 AM     Quality Assurance Engineer new REF. NUM: 227798     Nicosia  posted 19 days ago     DW Dynamic Works Ltd  expires in 12 days    929            CATEGORY: Computer Science  PUBLISHED BY: Private Company (LTD)   EMPLOYMENT TYPE: Fulltime INDUSTRY: Computer Science        The Quality Assurance Engineer will be responsible for identifying, reporting and eliminating defects for our products.Who is Dynamic Works and why is working for us more than just an experience?Dynamic Works launched in 2003 and quickly grew into an award-winning, internationally recognised Unified Online Business Solutions Provider, creating a host of websites and web applications for the Financial Services Industry, the Republic of Cyprus Government, and for a host of other verticals for startups and highly influential international brands. Dynamic Works is headquartered in Nicosia, Cyprus, and we also have got offices in Limassol, Cyprus, and London, England.Now that you know we’re a serious Unified Online Business Solutions Provider that’s going places, we think it’s time you found out what it’s like to work for Dynamic Works.Simply put, working for Dynamic Works will be one of the most enjoyable experiences you’re likely to have as a web applications developer. Our team is what drives us, moves us, shapes us. Our team is what makes Dynamic Works what it is.When it comes to adding to our team of highly skilled people, we pick talented individuals who are proud to think disruptively and who never settle for second best. Dynamic Works is action-packed with ‘out of the box’ thinkers, and our 17+ team members are valued, respected, and loved. You want to be a part of something like this, right?If you believe you can add your expertise to our team and add real value, you just might be the person we’re looking for.Check out the Quality Assurance Engineer's responsibilities below. If you believe you have what it takes, we definitely want to meet you! Key Responsibilities as a Quality Assurance Engineer in CyprusThe Quality Assurance Engineer will be responsible for identifying, reporting and eliminating defects for our products.Requirements, Qualifications & Attributes:We’re looking for someone who has a degree in Computer Science or a related field.Testing experience in Web and Mobile applicationsStrong knowledge of software QA methodologies, tools and processesGood written and oral communication skillsCreate detailed, comprehensive, and well-structured test plans and test casesEstimate, prioritize and plan testing activitiesIdentify, record, track, document thoroughly and critically all bugs, defects and suggested improvements Benefits of working for Dynamic WorksIf you’re successful in your application to become a Quality Assurance Engineer at Dynamic Works, you’re going to receive a truly competitive remuneration package including private medical insurance, a discretionary bonus at the end of the year, which is dependent on your performance, and a host of other benefits and outstanding perks. You’re going to be joining one of the most advanced Development companies in the world, and you’re going to be given the tools and the training to ensure you become the very best you can be. We’ll show you the door, you’ll have to open it and walk through it.Here at Dynamic Works, we’re into empowering our people, our family, and you’ll get to see that from the very first day you join us! Our working environment is like nothing you’ve ever experienced, and this is down to the team we have.Applying for the Quality Assurance Engineer rolePlease click on the link below to complete the online application form and send your CV for the attention of the Head of Human Resources and Administration:https://www.dynamicworks.eu/easyconsole.cfm/page/careerapp/position/1207All applications are treated confidentially, and by filling in the online application form, you confirm that you have read, understood, and accepted the Privacy Policy. We’re fully GDPR compliant here at Dynamic Works and take the storing of one’s personal data very seriously.  "
228167,https://www.ergodotisi.com/en/JobDetails/228167/Qiiwi-Games-AB,Nicosia,Qiiwi Games AB,Fulltime,not given,,"  QA Engineer    Nicosia CY    Web Design / Developing Computer Science   Qiiwi Games AB   Qiiwi Games is looking for a QA Engineer for games to be a key contributor to our Nicosia studio.   10/30/2023 12:00:00 AM 11/30/2023 12:00:00 AM     QA Engineer new REF. NUM: 228167     Nicosia  posted 14 days ago     Qiiwi Games AB  expires in 17 days    231            CATEGORY: Computer Science  PUBLISHED BY: Private Company (LTD)   EMPLOYMENT TYPE: Fulltime INDUSTRY: Web Design / Developing        Are you a talented person who's always looking for excellence and a fun, challenging work environment that is constantly expanding? Well then, Qiiwi Games is the perfect place for you!Our company Qiiwi Games is a developer of games for mobile platforms such as iOS and Android.The company’s current operations started in 2012 and the company has studios in Alingsas, Sweden and Nicosia, Cyprus. Key Requirements/Qualifications & Duties:A Bachelor’s or Master’s degree in Computer ScienceWorking experience in software quality assurance will be considered as an advantageComfortable working in an Agile environmentAttention to detailBug reporting Create and document test cases Familiarity with any test case management tools will be considered an advantageThinking outside the boxGood time management skillsFluency in EnglishWhat we offer:A competitive salary25 days paid vacation per yearYearly bonusesThe opportunity to be part of a cutting edge mobile gaming team, serving players all over the world!Be part of a cutting-edge mobile gaming team, serving players all over the world!To apply please send us your CV at: jobs@qiiwi.com  "
